Investor Name,Fund Type,Fund Stage,Website,Fund Focus (Sectors)
Inflection Point Ventures,Venture Fund,"Pre-SeedSeed,Series ASeries B,Series CSeries D",www.inflectpoint.com,"Fin, Tech"
Investor Name,Fund Type,Fund Stage,Website (if available),"Fund, Focus, Sectors"
InfraVia Capital Partners,Venture Fund,Series CSeries D,https://infraviacapital.com/,"Artificial Intelligence, Machine Learning, AI, ML, Virtual Reality, AR/VR, CloudTech, Developer Tools, Enterprise, Mobile, SaaS, Creator Economy, Meeting Software, Marketing, MarTech, Software"
Initialized Capital,Venture Fund,"Pre-SeedSeed,Series A",www.initialized.com,"AgTech, FarmTech, Food and Beverage, Marketplace, Software, B2B, E-Commerce, Industrials, Supply Chain, Tech, Cryptocurrency, Blockchain, EdTech, Information Technology, Advertising, AdTech, Marketing, MarTech, Manufacturing, Robotics, Developer Tools, Network Security, Cybersecurity, SaaS, Artificial Intelligence, Machine Learning, AI, ML, Computer, ClimateTech, CleanTech, Advanced Materials, Delivery, Logistics, Big Data, Analytics, FinTech, RestaurantTech, Construction, PropTech, Consumer, Health & Wellness, Productivity, Enterprise, GovTech, Mobile, Beauty"
InnoEnergy,Venture Fund,"SeedSeries A,Series B",http://www.innoenergy.com/,Robotics
Innogest Capital,Venture Fund,"SeedSeries A,Series B","http://www.innogestcapital.c
om","Artificial Intelligence, Machine Learning, AI, ML, Healthcare, Wearables, Quantified Self"
Innosphere Ventures,Accelerator,"SeedSeries A,Series B","http://innosphereventures.or
g/","ClimateTech, CleanTech, Healthcare, Life Science"
Innova Memphis,Venture Fund,"Pre-SeedSeed,Series A",www.innovamemphis.com,"BioTech, Healthcare, AgTech, FarmTech, Software, ClimateTech, CleanTech"
Innovating Capital,Venture Fund,"Pre-SeedSeed,Series ASeries B,Series CSeries D",www.innovating.capital,"BioTech, Healthcare"
Investor Name,Fund Type,Fund Stage,Website (if available),"Fund, Focus, Sectors"
Innovation Endeavors,Venture Fund,"Pre-SeedSeed,Series ASeries B,Series CSeries D","www.innovationendeavors.c
om","Big Data, Analytics, CloudTech, Cybersecurity, Software, EdTech, SaaS, Artificial Intelligence, Machine Learning, AI, ML, E-Commerce, Logistics, RetailTech, Robotics, Supply Chain, Tech, Marketing, MarTech, Enterprise, Information Technology, Construction, PropTech, AgTech, FarmTech, Hardware, Developer Tools, Healthcare, BioTech, Life Science, IoT, Internet of Things, Telecommunications, TMT, B2B, Sales, Professional Services, Privacy, Service Industry, Advertising, AdTech, Mobile, Entertainment, Media, Pharmaceuticals, Creator Economy, Computer, Transportation, Health & Wellness"
Inovia Capital,Venture Fund,"SeedSeries A,Series BSeries C,Series D",https://www.inovia.vc,"FinTech, HR Tech, InsurTech, Software, PropTech, Cybersecurity, Privacy, Productivity, Risk Management, Computer, SaaS, B2B, Information Technology, Sales, Advertising, AdTech, Marketing, MarTech, Entertainment, Media, Big Data, Analytics, Hardware, Virtual Reality, AR/VR, Hospitality, Consumer, Travel, FemTech, Healthcare, CloudTech, E-Commerce"
Inovo Venture Partners,Venture Fund,"SeedSeries A,Series B",http://inovo.vc/,"Artificial Intelligence, Machine Learning, AI, ML, Software, Mobile, CloudTech, Information Technology"
Insight Partners,Venture Fund,"Pre-SeedSeed,Series ASeries B,Series CSeries D",www.insightpartners.com,"Artificial Intelligence, Machine Learning, AI, ML, FinTech, Big Data, Analytics, CloudTech, Construction, Tech, Cybersecurity, Healthcare, E-Commerce, EdTech, E-Sports, Gaming, IoT, Internet of Things, Marketing, MarTech, Mobile, PropTech, SaaS, Telecommunications, TMT"
Inspiration Ventures,Venture Fund,"Pre-SeedSeed,Series A",www.inspirationvc.com,"Software, Mobile, SaaS, Consumer, FinTech"
Investor Name,Fund Type,Fund Stage,Website (if available),"Fund, Focus, Sectors"
Inspired Capital Partners,Venture Fund,"Pre-SeedSeed,Series A",www.inspiredcapital.com,"Artificial Intelligence, Machine Learning, AI, ML, Community, Information Technology, Robotics, Software, FinTech, Big Data, Analytics, InsurTech, Healthcare, Health & Wellness, HR Tech"
Intact Financial Corporation,Venture Fund,"SeedSeries A,Series B",http://www.intactfc.com/,"InsurTech, Mobile, PropTech, Software"
Intelis Capital,Venture Fund,"SeedSeries A,Series B","https://www.inteliscapital.co
m/","ClimateTech, CleanTech, Developer Tools, GovTech, Prop, Tech"
Interlace Ventures,Venture Fund,"Pre-SeedSeed,Series A",www.interlacevc.com,"Software, Mobile, SaaS, Consumer, FinTech"
Interlock Partners,Venture Fund,"Pre-SeedSeed,Series A",www.interlock.vc,"CloudTech, Enterprise, FinTech"
Interplay,Family Office,"SeedSeries A,Series B",http://www.interplay.vc,"Entertainment, Media, Food and Beverage, E-Commerce, Hospitality, PaaS, RestaurantTech, Consumer, Fashion, Manufacturing, Software, Supply Chain, Tech, Logistics, Travel, Artificial Intelligence, Machine Learning, AI, ML, Marketing, MarTech, Big Data, Analytics, HR Tech, InsurTech, Transportation, Advertising, AdTech, Information Technology, SaaS, Healthcare, Legal Tech, Fin"
Intersouth Partners,Venture Fund,"Pre-SeedSeed,Series ASeries B,Series CSeries D",www.intersouth.com,"Software, Mobile, SaaS, Consumer, FinTech"
InterWest Partners,Venture Fund,"Pre-SeedSeed,Series ASeries B,Series CSeries D",www.interwest.com,"E-Commerce, Fashion, Advertising, AdTech, Big Data, Analytics, Marketing, MarTech, Entertainment, Media, SaaS, Software, Information, Technology"
Invus,Venture Fund,"Pre-SeedSeed,Series ASeries B,Series CSeries D",www.invus.com,"BioTech, Pharmaceuticals, Healthcare, Wearables, Quantified Self, Artificial Intelligence, Machine Learning, AI, ML, FinTech, Food and Beverage, Hospitality, RestaurantTech, Life Science"
Investor Name,Fund Type,Fund Stage,Website (if available),"Fund, Focus, Sectors"
Ion Pacific,Venture Fund,"SeedSeries A,Series B",http://ionpacific.com,"Fin, Tech"
IOSG Ventures,Venture Fund,"SeedSeries A,Series BPre-Seed",http://iosg.vc,"Cryptocurrency, Blockchain, Information Technology, Software, CloudTech, Big Data, Analytics"
Iris Capital,Venture Fund,"SeedSeries A,Series BSeries C,Series D",http://www.iriscapital.com,"Big Data, Analytics, Enterprise, Software"
Iron Gate Capital,Venture Fund,"Series BSeries C,Series D",www.irongatecapital.com,"IoT, Internet of Things, SaaS, Software, Transportation, Consumer, Hardware, Industrials, Manufacturing, Delivery, Logistics, Mobile"
Iron Pillar,Venture Fund,Series CSeries D,"https://www.ironpillarfund.c
om/","Artificial Intelligence, Machine Learning, AI, ML, CloudTech, Customer Service, Information Technology, SaaS, Software"
IronGate Capital Advisors,Venture Fund,"SeedSeries A,Series BSeries C,Series D",https://www.irongatevc.com,"Manufacturing, Artificial Intelligence, Machine Learning, AI, ML, Virtual Reality, AR/VR, Big Data, Analytics, Cybersecurity, FinTech, Infrastructure, Robotics, SaaS, Space, Tech"
Ironspring,Venture Fund,Seed,https://www.ironspring.com/,"B2B, Information Technology, Software"
ISA Ventures,Venture Fund,"SeedSeries A,Series B","https://www.isaventures.com
/","Healthcare, Service Industry, HR Tech"
iSELECT FUND,Venture Fund,"Pre-SeedSeed,Series ASeries B,Series CSeries D",www.iselectfund.com,"BioTech, Life Science, Healthcare, Food and Beverage, Software, AgTech, FarmTech, Big Data, Analytics, Artificial Intelligence, Machine Learning, AI, ML, Robotics"
Israel Growth Partners,Venture Fund,Series CSeries D,http://www.igpcapital.com,"Enterprise, Quality Assurance, Risk Management, SaaS, Software, CRM, E-Commerce, Information Technology, Sales, Automation"
Investor Name,Fund Type,Fund Stage,Website (if available),"Fund, Focus, Sectors"
IVP,Venture Fund,"Series BSeries C,Series D",www.ivp.com,"Virtual Reality, AR/VR, Software, E-Sports, Gaming, CloudTech, Developer Tools, Productivity, Healthcare, Health, Wellness, Artificial Intelligence, Machine Learning, AI, ML, Logistics, SaaS, Transportation, BioTech, Life Science, Big Data, Analytics, Cybersecurity, AudioTech, Network Security, Collaboration, Consumer, Information Technology, PaaS, B2B, Enterprise, Marketing, MarTech, Marketplace, HR Tech, Legal Tech, Hardware, Wearables, Quantified Self, Beauty, Fashion, Robotics, Computer, InsurTech, Community, Entertainment, Media, FinTech, EdTech, Advertising, AdTech, Mobile, Creator Economy"
Investor Name,Fund Type,Fund Stage,Website (if available),"Fund, Focus, Sectors"
J Ventures,Venture Fund,"SeedSeries A,Series B",www.jventures.com,"FinTech, SaaS, Cryptocurrency, Blockchain, Advertising, AdTech, Big Data, Analytics, PropTech, Manufacturing, Artificial Intelligence, Machine Learning, AI, ML, Virtual Reality, AR/VR, Developer Tools, AgTech, FarmTech, AudioTech, B2C, Beauty, B2B, Bio, Tech, Black, African, American, Founded, Cannabis, ClimateTech, CleanTech, Productivity, CloudTech, Cloud, Security, Construction, Infrastructure, Consumer, Creator Economy, CRM, Hardware, Cybersecurity, Wearables, Quantified Self, Customer Service, D2C, DeepTech, Healthcare, Entertainment, Media, E-Commerce, EdTech, HR Tech, Energy, Enterprise, E-Sports, Gaming, Events, FemTech, Food and Beverage, RestaurantTech, Future of Work, GovTech, Impact Investing, Information Technology, InsurTech, IoT, Internet of Things, Telecommunications, TMT, Mobile, Legal Tech, Life Science, Marketing, MarTech, Logistics, Marketplace, Meeting Software, Micro-Mobility, Network Security, Neuroscience, Oil & Gas, Travel, PaaS, PetTech, Pharmaceuticals, Recruiting, RetailTech, Robotics, Sales, Ridesharing, Sharing Economy, Social Media, Sports, Supply Chain, Sustainability, Women-Founded, Transportation, SpaceTech, Software"
J-Ventures,Venture Fund,"Pre-SeedSeed,Series ASeries B,Series CSeries D",www.j-ventures.com,"Artificial Intelligence, Machine Learning, AI, ML, ClimateTech, CleanTech, Cybersecurity, EdTech, FinTech, RestaurantTech, Life Science, Robotics"
Investor Name,Fund Type,Fund Stage,Website (if available),"Fund, Focus, Sectors"
Jackson Square Ventures,Venture Fund,"Pre-SeedSeed,Series A",www.jsv.com,"Construction, Tech, Information Technology, PropTech, SaaS, Healthcare, EdTech, E-Commerce, FinTech, Enterprise, Mobile, Productivity, Software, Marketing, MarTech, Advertising, AdTech, Cybersecurity, Health & Wellness, Entertainment, Media, Sports"
JAL Ventures,Venture Fund,"SeedSeries A,Series B",http://www.jalventures.com/,"Artificial Intelligence, Machine Learning, AI, ML, Entertainment, Media, CMS, EdTech"
January Ventures,Venture Fund,"Pre-SeedSeed,Series A",www.january.ventures,"Artificial Intelligence, Machine Learning, AI, ML, FinTech, Cybersecurity, Healthcare, E-Commerce, FemTech, HR Tech, Legal Tech, Marketing, MarTech, PropTech, SaaS, Supply Chain, Tech"
Javelin Venture Partners,Venture Fund,"Pre-SeedSeed,Series A",www.javelinvp.com,"Advertising, AdTech, FinTech, Healthcare, E-Commerce, IoT, Internet of Things, Life Science, Mobile, SaaS, Telecommunications, TMT"
Jazz Venture Partners,Venture Fund,"Pre-SeedSeed,Series A",www.jazzvp.com,"EdTech, HR Tech, Information Technology, Software, Healthcare, Health & Wellness, Robotics, Enterprise, Virtual Reality, AR/VR, Artificial Intelligence, Machine Learning, AI, ML, Life Science, Medical Device"
JDS Sports,Venture Fund,"Pre-SeedSeed,Series A",www.jdssports.co,"Software, Mobile, SaaS, Consumer, FinTech"
"Jerusalem Venture Partners
(JVP)",Venture Fund,"SeedSeries A,Series BSeries C,Series D",http://www.jvpvc.com,"Enterprise, HR Tech, SaaS, B2B, CloudTech, Cybersecurity, Software, Big Data, Analytics, Telecommunications, TMT, InsurTech, Information, Technology, Artificial Intelligence, Machine Learning, AI, ML, Marketing, MarTech, Sales, CRM, E-Commerce"
JK&B Capital,Venture Fund,"Pre-SeedSeed,Series ASeries B,Series CSeries D",www.jkbcapital.com,"Software, Mobile, SaaS, Consumer, FinTech"
Investor Name,Fund Type,Fund Stage,Website (if available),"Fund, Focus, Sectors"
JLL Spark,Corporate VC,"SeedSeries A,Series B",https://spark.jll.com/,"EdTech, Big Data, Analytics, Artificial Intelligence, Machine Learning, AI, ML, Hardware, Information Technology, PropTech, SaaS, Enterprise, Consumer, Software, InsurTech"
JLS Fund,Venture Fund,"SeedSeries A,Series B",https://www.jls.fund/,"Healthcare, Life Science"
JMI Equity,Venture Fund,Series CSeries D,https://jmi.com/,"Cybersecurity, Information Technology, Software, Risk Management, SaaS, PropTech, IoT, Internet of Things, Enterprise, Advertising, AdTech, Big Data, Analytics, Marketing, MarTech, Mobile, Construction, Tech, Entertainment, Media, EdTech, Developer Tools, CloudTech, FinTech, Events, HR Tech, Computer, GovTech, Healthcare, Meeting"
Johnson Venture Partners,Venture Fund,"Pre-SeedSeed,Series A",www.jvpfund.com,"Software, Mobile, SaaS, Consumer, FinTech"
Joyance Partners,Venture Fund,"Pre-SeedSeed,Series A",www.joyancepartners.com,"Consumer, FemTech"
JP Morgan Chase,Corporate VC,"Series CSeries D,Series B","http://www.jpmorganchase.c
om","Virtual Reality, AR/VR, Consumer, Hardware, Software, Wearables, Quantified Self, FinTech, EdTech, Big Data, Analytics, Cryptocurrency, Blockchain, Cybersecurity, CloudTech, Artificial Intelligence, Machine Learning, AI, ML, Mobile, Information Technology, SaaS, Telecommunications, TMT, Entertainment, Media, Developer Tools, Healthcare, HR Tech, Collaboration, E-Commerce, Enterprise, Risk Management, Transportation, Market Research, ClimateTech, CleanTech, Energy, Productivity, CMS, Beauty, RetailTech"
Jump Capital,Venture Fund,"Pre-SeedSeed,Series ASeries B,Series CSeries D",www.jumpcap.com,"FinTech, Consumer, E-Commerce, Sales, Cryptocurrency, Blockchain, Artificial Intelligence, Machine Learning, AI, ML, Developer Tools, Information Technology, Service Industry, Cybersecurity, Software, Virtual Reality, AR/VR, Fashion, RetailTech, Big Data, Analytics, CloudTech, Enterprise, SaaS, Mobile, EdTech, Quality Assurance, Infrastructure, Healthcare, Risk Management, Telecommunications, TMT, Marketplace, Sports, Transportation, IoT, Internet of Things, Manufacturing, Robotics, E-Sports, Gaming, Advertising, AdTech, Marketing, MarTech, Creator Economy"
JumpStart,Accelerator,"SeedSeries A,Series B",http://www.jumpstartinc.org,"BioTech, Healthcare, Software, Hardware, Artificial Intelligence, Machine Learning, AI, ML, Developer Tools, Cybersecurity, Enterprise, Risk Management"
Jumpstart Foundry,Accelerator,"Pre-SeedSeed,Series A",www.jsf.co,"Software, Mobile, SaaS, Consumer, FinTech"
Jungle Ventures,Venture Fund,"SeedSeries A,Series B",https://www.jungle.vc,"PropTech, Consumer, SaaS, Software"
Jurassic Capital,Venture Fund,"SeedSeries A,Series B",https://jurassiccapital.com/,"B2B, E-Commerce, SaaS, Software"
Juvo Ventures,Venture Fund,"Pre-SeedSeed,Series ASeries B",https://juvovc.org/,"Artificial Intelligence, Machine Learning, AI, ML, EdTech, Information Technology, SaaS"
Juxtapose,Venture Fund,"Pre-SeedSeed,Series A",www.juxtapose.com,"Healthcare, Consumer, Health & Wellness"
K Fund,Venture Fund,"SeedSeries A,Series B",http://kfund.vc,"Artificial Intelligence, Machine Learning, AI, ML, HR Tech, Information Technology, SaaS, Software, FinTech, InsurTech, PropTech"
Investor Name,Fund Type,Fund Stage,Website (if available),"Fund, Focus, Sectors"
K1 Investment Management,Venture Fund,"Series BSeries C,Series D",www.k1capital.com,"PropTech, SaaS, Artificial Intelligence, Machine Learning, AI, ML, CloudTech, CRM, Sales, Software, Collaboration, Enterprise, Productivity, Cybersecurity, FinTech, Information Technology, EdTech, Big Data, Analytics, Healthcare"
K2 Global,Venture Fund,"Pre-SeedSeed,Series ASeries B,Series CSeries D",www.k2globalvc.com,"B2B, Consumer, E-Commerce, Food and Beverage, Logistics, Marketplace, RetailTech"
K2 Global,Venture Fund,SeedSeries A,https://k2global.co,"AgTech, FarmTech, FoodTech, Advertising, AdTech, Healthcare, Cryptocurrency, Blockchain, PropTech, Mobile, Telecommunications, TMT, Software, BioTech, Logistics, AudioTech, EdTech, Big Data, Analytics, E-Commerce, FinTech, Artificial Intelligence, Machine Learning, AI, ML"
K2VC,Venture Fund,"SeedSeries A,Series B",http://www.k2vc.com/,"Beauty, E-Commerce, RetailTech, Community, PropTech"
K5 Global,Venture Fund,"Pre-SeedSeries A,Series CSeed,Series BSeries D",http://www.k5global.com/,"Advertising, AdTech, SaaS, Telecommunications, TMT"
K50 Ventures,Venture Fund,"SeedSeries A,Series B","https://www.k50ventures.co
m/","EdTech, Software, Healthcare"
Kae Capital,Venture Fund,"SeedSeries A,Series B",http://www.kae-capital.com,"Enterprise, Artificial Intelligence, Machine Learning, AI, ML, SaaS, Sales"
Kairos,Accelerator,"Pre-SeedSeed,Series A",www.kairoshq.com,"Software, Mobile, SaaS, Consumer, FinTech"
Kairos Ventures,Venture Fund,"Pre-SeedSeed,Series A",www.kairosventures.com,"BioTech, Healthcare, Pharmaceuticals"
Kakao Ventures,Venture Fund,"SeedSeries A,Series B",https://www.kakao.vc/,"Collaboration, Enterprise, Information Technology, Productivity, SaaS, Software"
Kalaari Capital,Venture Fund,"SeedSeries A,Series BSeries C,Series D",http://www.kalaari.com,"SaaS, Software, Collaboration, Enterprise, Productivity, Tools"
Investor Name,Fund Type,Fund Stage,Website (if available),"Fund, Focus, Sectors"
Kapor Capital,Venture Fund,"Pre-SeedSeed,Series ASeries B,Series CSeries D",www.kaporcapital.com,"Telecommunications, TMT"
Karlani Capital,Venture Fund,"Pre-SeedSeed,Series A",www.karlani.com,"GovTech, SaaS, Software"
Karlin Ventures,Venture Fund,"Pre-SeedSeed,Series A",www.karlinvc.com,"Software, Mobile, SaaS, Consumer, FinTech"
Kaszek,Venture Fund,"SeedSeries A,Series BSeries C,Series D",http://www.kaszek.com,"HR Tech, Health & Wellness, FinTech, Software"
Katalyst.Ventures,Venture Fund,"SeedSeries A,Series B",https://katalyst.ventures,"BioTech, Healthcare, Pharmaceuticals"
KB Partners,Venture Fund,"Pre-SeedSeed,Series A",www.kbpartners.com,"Virtual Reality, AR/VR, E-Sports, Gaming, Healthcare, Mobile, SaaS, Wearables, Quantified Self"
KCRise Fund,Venture Fund,"SeedSeries A,Series BSeries C,Series D",https://kcrisefund.com/,"FinTech, GovTech, Mobile, Health & Wellness, Healthcare, Information Technology, Professional Services, Elder Care, HR Tech, ClimateTech, CleanTech, Developer Tools, PropTech, E-Sports, Gaming, Sports"
KdT Ventures,Venture Fund,"Pre-SeedSeed,Series A",www.kdtvc.com,Life Science
KEC Ventures,Venture Fund,"Pre-SeedSeed,Series A",www.kecventures.com,"Software, Mobile, SaaS, Consumer, FinTech"
Keiretsu Capital,Venture Fund,"SeedSeries A,Series BSeries C,Series D","http://www.keiretsucapital.co
m/","BioTech, Healthcare"
Keiretsu Forum,Angel Network,"Pre-SeedSeed,Series ASeries B,Series CSeries D",www.keiretsuforum.com,"BioTech, Healthcare, FinTech, Customer Service, Hospitality, RestaurantTech, SpaceTech, Construction, Tech, Oil & Gas"
Kenetic,Venture Fund,"SeedSeries A,Series B",https://kenetic.capital/,"Cryptocurrency, Blockchain, Developer Tools, Enterprise, FinTech, Information Technology"
Investor Name,Fund Type,Fund Stage,Website (if available),"Fund, Focus, Sectors"
Kern Venture Group,Venture Fund,"SeedSeries A,Series B",http://kernvg.com,"Manufacturing, AgTech, FarmTech, Virtual Reality, AR/VR, FinTech, Big Data, Analytics, ClimateTech, CleanTech, CloudTech, Construction, Tech, Cybersecurity, Healthcare, E-Commerce, EdTech, E-Sports, Gaming, FemTech, RestaurantTech, HR Tech, Impact Investing, Infrastructure, InsurTech, IoT, Internet of Things, Legal Tech, Life Science, Marketing, MarTech, Micro-Mobility, Mobile, PropTech, Oil & Gas, PetTech, Robotics, SaaS, SpaceTech, Supply Chain, Telecommunications, TMT, Wearables, Quantified Self"
KEY Investment Partners,Venture Fund,"SeedSeries A,Series BSeries C","https://www.keyinvestmentp
artners.com/","CRM, Mobile"
KG Investments,Venture Fund,"Pre-SeedSeed,Series A",www.kginvest.net,"Software, Mobile, SaaS, Consumer, FinTech"
Khosla Ventures,Venture Fund,"Pre-SeedSeed,Series ASeries B,Series CSeries D",www.khoslaventures.com,"Big Data, Analytics, Developer Tools, Enterprise, Information Technology, ClimateTech, CleanTech, Energy, Oil & Gas, BioTech, Healthcare, CloudTech, Software, Artificial Intelligence, Machine Learning, AI, ML, Cybersecurity, Entertainment, Media, Consumer, Sports, IoT, Internet of Things, Mobile, Wearables, Quantified Self, FinTech, Marketplace, SaaS, Travel, Fashion, Manufacturing, HR Tech, EdTech, Food and Beverage, Delivery, E-Commerce, Logistics, InsurTech, RetailTech, Sales, PropTech, Transportation, Computer, Construction, Tech, AgTech, FarmTech, Robotics, Hardware, Professional Services, RestaurantTech, Pharmaceuticals, Health & Wellness, Nanotechnology, Network Security, Risk Management, Telecommunications, TMT, Marketing, MarTech, PoS, Point of Sale, Productivity, B2B, Advanced Materials, Life Science, DeepTech, Elder Care, Collaboration, Future of Work, CMS, Legal Tech, PetTech"
Investor Name,Fund Type,Fund Stage,Website (if available),"Fund, Focus, Sectors"
Kickstart,Venture Fund,"Pre-SeedSeed,Series A",www.kickstartfund.com,"Big Data, Analytics, Enterprise, Marketing, MarTech, SaaS, Developer Tools, Software, Healthcare, Information Technology, Consumer, E-Commerce, Outdoors, RetailTech, CloudTech, Productivity, Telecommunications, TMT, Mobile, AgTech, FarmTech, Hardware, Manufacturing, Health & Wellness, FinTech, Food and Beverage, Hospitality, HR Tech, Sales, PropTech, Marketplace, Artificial Intelligence, Machine Learning, AI, ML, Cryptocurrency, Blockchain, Creator Economy, IoT, Internet of Things, EdTech, Community, Entertainment, Media, Computer"
Kima Ventures,Venture Fund,"SeedSeries A,Series B","http://www.kimaventures.co
m","FinTech, Marketing, MarTech, SaaS, CRM, E-Commerce, Enterprise, Artificial Intelligence, Machine Learning, AI, ML, Big Data, Analytics, Mobile, InsurTech, PropTech, CMS, Sales, Software, Cybersecurity, Information Technology, Entertainment, Media, Consumer, Fashion, RetailTech, HR Tech, Health & Wellness, Healthcare, EdTech, Hardware, Manufacturing, CloudTech, Marketplace, Professional Services, SpaceTech, Hospitality, Transportation, AgTech, FarmTech, ClimateTech, CleanTech, E-Sports, Gaming, Computer, IoT, Internet of Things"
Kindred Ventures,Venture Fund,Seed,www.kindredventures.com,"Healthcare, Hardware, Manufacturing, Robotics, Transportation"
Kinetic Ventures,Venture Fund,"Pre-SeedSeed,Series ASeries B,Series CSeries D",www.kineticventures.com,"FinTech, Mobile, Software"
King River Capital,Venture Fund,"Series ASeries B,Series CSeries D",http://www.kingriver.co/,"FinTech, InsurTech"
Kingfisher Investment Advisors,Venture Fund,Series CSeries D,"https://www.kingfisherinvest
ment.com","Cybersecurity, FinTech, SaaS, Telecommunications, TMT"
Investor Name,Fund Type,Fund Stage,Website (if available),"Fund, Focus, Sectors"
Kingsway Capital,Venture Fund,"SeedSeries A,Series B","http://www.kingswaycap.co
m/","FinTech, Cryptocurrency, Blockchain, PoS, Point of Sale"
Kirenaga Partners,Venture Fund,"SeedSeries A,Series B",http://kirenaga.com/,"Artificial Intelligence, Machine Learning, AI, ML, IoT, Internet of Things, Robotics, Creator Economy"
KiwiVenture Partners,Venture Fund,"SeedSeries A,Series B","http://www.kiwiventurepartn
ers.com/","Advertising, AdTech, E-Commerce, Marketing, MarTech, Retail, Tech"
Kleiner Perkins,Venture Fund,"Pre-SeedSeed,Series ASeries B,Series CSeries D",www.kleinerperkins.com,"Big Data, Analytics, Enterprise, Productivity, Software, FinTech, CloudTech, Cybersecurity, Privacy, Consumer, IoT, Internet of Things, HR Tech, Artificial Intelligence, Machine Learning, AI, ML, Information Technology, Entertainment, Media, SaaS, Healthcare, ClimateTech, CleanTech, Cryptocurrency, Blockchain, Sports, Marketplace, Mobile, Travel, E-Commerce, Marketing, MarTech, SpaceTech, Manufacturing, Developer Tools, Infrastructure, EdTech, B2B, PropTech, Logistics, Robotics, Supply Chain, Tech, E-Sports, Gaming, Fashion, Health & Wellness, Wearables, Quantified Self, Parenting, Sales, CRM, Professional Services, Hardware, PaaS, RestaurantTech, Virtual Reality, AR/VR, Collaboration, Computer, BioTech, RetailTech, Food and Beverage, Telecommunications, TMT, Customer Service, Future of Work, InsurTech, Elder Care, Advanced Materials"
Kli Capital,Venture Fund,"SeedSeries A,Series B",http://www.klicapital.vc,"AgTech, FarmTech, ClimateTech, CleanTech, FinTech, Healthcare, InsurTech, Mobile, PropTech, SaaS, Telecommunications, TMT"
Knightsgate Ventures,Venture Fund,"SeedSeries A,Series B","https://knightsgateventures.
com/","Consumer, E-Commerce, Fashion"
Knoll Ventures,Venture Fund,"SeedSeries A,Series B","http://www.knollventures.co
m","Healthcare, Big Data, Analytics, CloudTech, Enterprise, SaaS, Software, Transportation, ClimateTech, CleanTech, E-Commerce, Energy, Ridesharing, Logistics"
Investor Name,Fund Type,Fund Stage,Website (if available),"Fund, Focus, Sectors"
Koa Labs,Accelerator,Seed,http://koalab.com/,"Big Data, Analytics, Healthcare, IoT, Internet of Things, SaaS, Wearables, Quantified Self"
Kompas,Venture Fund,"SeedSeries A,Series B",http://www.kompas.vc,"ClimateTech, CleanTech, Software"
Kortschak Investments L.P.,Venture Fund,"Pre-SeedSeed,Series ASeries B,Series CSeries D",www.kortschak.com,"Software, Mobile, SaaS, Consumer, FinTech"
Kreos Capital,Venture Fund,"SeedSeries A,Series BSeries C,Series D",http://www.kreoscapital.com,"CloudTech, Big Data, Analytics, Enterprise, Software, Telecommunications, TMT, E-Commerce, Logistics, Transportation, Travel"
Krillion Ventures,Venture Fund,"SeedSeries A,Series B","http://www.krillionventures.c
om","PropTech, Software, AgTech, FarmTech, Enterprise, Supply Chain, Tech, Life Science"
L2 Ventures,Venture Fund,"SeedSeries A,Series BSeries C,Series D",https://www.l2v.com/,"Cannabis, H, Tech"
L37 Ventures,Venture Fund,"SeedSeries A,Series BSeries C,Series D",http://www.l37.vc,"Cryptocurrency, Blockchain, Information Technology, Oil & Gas, Software"
