Investor Name,Fund Type,Fund Stage,Website,Fund Focus (Sectors)
Rally Ventures,Venture Fund,"Pre-SeedSeed,Series A",www.rallyventures.com,"PropTech, FinTech, Artificial Intelligence, Machine Learning, AI, ML, Marketing, MarTech, Sales, Software, Delivery, Hospitality, Marketplace, RestaurantTech, Enterprise, Big Data, Analytics, Cybersecurity, Information Technology, Healthcare, Pharmaceuticals, Mobile, Entertainment, Media, Advertising, AdTech, B2B, SaaS, CloudTech, Computer, Hardware"
Rapha Capital Management,Venture Fund,"Pre-SeedSeed,Series ASeries B",https://raphacap.com/,"Healthcare, Life Science"
Razor's Edge Ventures,Venture Fund,"Pre-SeedSeed,Series ASeries B,Series CSeries D",www.razorsvc.com,"CloudTech, Cybersecurity, SaaS, SpaceTech, Big Data, Analytics, Developer Tools, Information, Technology"
Reach Capital,Venture Fund,"Pre-SeedSeed,Series A",www.reachcapital.com,"EdTech, Virtual Reality, AR/VR, HR Tech, Software, CloudTech, Developer Tools, Information Technology, Professional Services, Productivity, Parenting, Artificial Intelligence, Machine Learning, AI, ML, Marketplace, Telecommunications, TMT, FinTech, Computer, Hardware, Entertainment, Media, SaaS, Enterprise"
Real Ventures,Venture Fund,"SeedSeries A,Series B",http://realventures.com,"Big Data, Analytics, B2B, Cybersecurity, SaaS, Software, Robotics, FinTech"
Realist Ventures,Venture Fund,"SeedSeries A,Series BSeries C,Series D","http://www.realistventures.c
om","Artificial Intelligence, Machine Learning, AI, ML, Big Data, Analytics, ClimateTech, CleanTech, CloudTech, Cybersecurity, Healthcare, SaaS"
Realization Capital Partners,Venture Fund,Series CSeries D,http://www.realicap.com,"Mobile, Community, Consumer, Marketing, MarTech, Entertainment, Media, Outdoors, Software, Travel"
Investor Name,Fund Type,Fund Stage,Website (if available),"Fund, Focus, Sectors"
Rebel Fund,Venture Fund,Seed,www.rebelfund.vc,"Computer, PaaS, Software, Advertising, AdTech, Artificial Intelligence, Machine Learning, AI, ML, Marketing, MarTech, Information Technology, Entertainment, Media, Enterprise, Events, SaaS, Healthcare"
Reciprocal Ventures,Venture Fund,"Pre-SeedSeed,Series A",www.recvc.com,"Software, Mobile, SaaS, Consumer, FinTech"
Recurring Capital Partners,Venture Fund,"Series ASeries B,Seed",http://recurring.capital,"Enterprise, Mobile, B2B, E-Commerce, SaaS, Software"
Red Bike Capital,Venture Fund,Seed,https://redbikecapital.com/,"E-Commerce, SaaS"
Red Dog Capital,Venture Fund,"Pre-SeedSeed,Series A",www.reddogcap.com,"Software, Mobile, SaaS, Consumer, FinTech"
Red Swan Ventures,Venture Fund,"Pre-SeedSeed,Series A",www.redswanventures.com,"Software, Mobile, SaaS, Consumer, FinTech"
Red Tree Venture Capital,Venture Fund,"SeedSeries A,Series BSeries C","https://redtreeventurecapital
.com/","Life Science, BioTech"
RedBird Capital Partners,Venture Fund,"Series BSeries C,Series D",http://www.redbirdcap.com/,"SpaceTech, Transportation, ClimateTech, CleanTech, Manufacturing, Energy, Sports, Telecommunications, TMT, FinTech, Consumer, Industrials"
Redesign Health,Venture Fund,"Pre-SeedSeed,Series A",www.redesignhealth.com,Healthcare
Redhawk VC,Venture Fund,"SeedSeries A,Series B","https://redhawkadvisory.com
/","E-Commerce, Healthcare, FinTech, Pharmaceuticals, PoS, Point of Sale"
Redline Capital,Venture Fund,"SeedSeries A,Series BSeries C,Series D",http://redline-capital.com/,"Computer, Marketing, MarTech, Software, Big Data, Analytics, Developer Tools, Information, Technology, Artificial Intelligence, Machine Learning, AI, ML, Infrastructure, Hardware"
Investor Name,Fund Type,Fund Stage,Website (if available),"Fund, Focus, Sectors"
Redpoint,Venture Fund,"Pre-SeedSeed,Series ASeries B,Series CSeries D",www.redpoint.com,"EdTech, Big Data, Analytics, Developer Tools, Enterprise, Productivity, Software, B2B, Information Technology, Professional Services, Sales, AudioTech, Network, Security, Artificial Intelligence, Machine Learning, AI, ML, FinTech, PropTech, SaaS, E-Commerce, Marketing, MarTech, B2C, Quality Assurance, CloudTech, Healthcare, Collaboration, HR Tech, InsurTech, Computer, CRM, Supply Chain, Tech, Logistics, Hardware, DeepTech, Community, Events, Entertainment, Media, Robotics, IoT, Internet of Things, Market Research, Cryptocurrency, Blockchain, PaaS, Consumer, BioTech, Delivery, RetailTech, RestaurantTech, Food and Beverage, Fashion, Infrastructure, Cybersecurity, Mobile, Creator Economy, Telecommunications, TMT, Marketplace, Hospitality"
Redwood Ventures,Venture Fund,"Pre-SeedSeed,Series A",www.redwood.ventures,"Software, Mobile, SaaS, Consumer, FinTech"
Refactor Capital,Venture Fund,"Pre-SeedSeed,Series A",www.refactor.com,"Artificial Intelligence, Machine Learning, AI, ML, Healthcare, Health & Wellness, BioTech, Advanced Materials, Life Science, Hardware, Software, Developer Tools, Consumer, PaaS, Big Data, Analytics, RetailTech, SaaS, Sales, Supply Chain, Tech"
REFASHIOND Ventures,Venture Fund,"SeedSeries A,Series B",http://www.refashiond.com/,E-Commerce
Reflective Venture Partners,Accelerator,"Pre-SeedSeed,Series A",www.reflectiveventures.io,"Software, Mobile, SaaS, Consumer, FinTech"
ReGen Ventures,Venture Fund,"SeedSeries A,Series B",https://regen.vc/,"ClimateTech, CleanTech"
Regeneration.VC,Venture Fund,"SeedSeries A,Series B",https://www.regeneration.vc/,"BioTech, Fashion, Manufacturing"
Investor Name,Fund Type,Fund Stage,Website (if available),"Fund, Focus, Sectors"
Reign Ventures,Venture Fund,"SeedSeries A,Series B",https://www.reignvc.com/,"Telecommunications, TMT"
Relay Ventures,Venture Fund,"SeedSeries A,Series B",http://relayventures.com/,"Artificial Intelligence, Machine Learning, AI, ML, EdTech, Information Technology, Telecommunications, TMT, Customer Service, Enterprise, Software, Entertainment, Media, Health & Wellness, CloudTech, Developer Tools, IoT, Internet of Things, Mobile"
"Relevance Ventures (formerly
Relevance Capital)",Venture Fund,"Pre-SeedSeed,Series A",www.relevanceventures.com,"Healthcare, PetTech"
Rembrandt Venture Partners,Venture Fund,"Pre-SeedSeed,Series ASeries B,Series CSeries D",www.rembrandtvc.com,"CloudTech, Cybersecurity, Big Data, Analytics, Network Security, Marketplace, SaaS, Collaboration, Enterprise, Productivity"
Investor Name,Fund Type,Fund Stage,Website (if available),"Fund, Focus, Sectors"
Remote First Capital,Venture Fund,"Pre-SeedSeed,Series A",www.remotefirstcapital.com,"FinTech, SaaS, Cryptocurrency, Blockchain, Advertising, AdTech, Big Data, Analytics, PropTech, Manufacturing, Artificial Intelligence, Machine Learning, AI, ML, Virtual Reality, AR/VR, Developer Tools, AgTech, FarmTech, AudioTech, B2C, Beauty, B2B, Bio, Tech, Black, African, American, Founded, Cannabis, ClimateTech, CleanTech, Productivity, CloudTech, Cloud, Security, Construction, Infrastructure, Consumer, Creator Economy, CRM, Hardware, Cybersecurity, Wearables, Quantified Self, Customer Service, D2C, DeepTech, Healthcare, Entertainment, Media, E-Commerce, EdTech, HR Tech, Energy, Enterprise, E-Sports, Gaming, Events, FemTech, Food and Beverage, RestaurantTech, Future of Work, GovTech, Impact Investing, Information Technology, InsurTech, IoT, Internet of Things, Telecommunications, TMT, Mobile, Legal Tech, Life Science, Marketing, MarTech, Logistics, Marketplace, Meeting Software, Micro-Mobility, Network Security, Neuroscience, Oil & Gas, Travel, PaaS, PetTech, Pharmaceuticals, Recruiting, RetailTech, Robotics, Sales, Ridesharing, Sharing Economy, Social Media, Sports, Supply Chain, Sustainability, Women-Founded, Transportation, SpaceTech, Software"
Renegade Partners,Venture Fund,Series A,"https://www.renegadepartne
rs.com/","Consumer, E-Commerce, RetailTech"
Renewal Funds,Venture Fund,"SeedSeries A,Series B","http://www.renewalfunds.co
m/","Food and Beverage, Productivity, Software, Supply Chain, Tech, Big Data, Analytics, Information, Technology"
Investor Name,Fund Type,Fund Stage,Website (if available),"Fund, Focus, Sectors"
Resolute Ventures,Venture Fund,"Pre-SeedSeed,Series A",www.resolute.vc,"FinTech, Big Data, Analytics, CloudTech, E-Commerce, IoT, Internet of Things, Marketing, MarTech, Mobile, SaaS, Telecommunications, TMT"
responsAbility,Venture Fund,"Series BSeries C,Series D","http://www.responsability.co
m","ClimateTech, CleanTech, Consumer"
RET Ventures,Venture Fund,"Pre-SeedSeed,Series A",www.ret.vc,"Developer Tools, CRM, Professional Services, Information Technology, Marketing, MarTech, Marketplace, PropTech, Software"
Rethink Impact,Venture Fund,"Pre-SeedSeed,Series A",www.rethinkimpact.com,"Big Data, Analytics, ClimateTech, CleanTech, Enterprise, GovTech, Information Technology, IoT, Internet of Things, Artificial Intelligence, Machine Learning, AI, ML, Software, AgTech, FarmTech, B2B, E-Commerce, Food and Beverage, Marketplace, RetailTech, Parenting, EdTech, FinTech, Events, Healthcare, Health & Wellness, Energy"
Revolution,Venture Fund,"Pre-SeedSeed,Series ASeries B,Series CSeries D","https://revolution.com/entity
/ventures/","Transportation, Energy, ClimateTech, CleanTech, Customer Service, Hospitality, Travel, Healthcare, EdTech, Software, E-Commerce, Fashion, RetailTech, Wearables, Quantified Self, Consumer, Artificial Intelligence, Machine Learning, AI, ML, Hardware, IoT, Internet of Things, PropTech, Delivery, Information Technology, Cybersecurity, Privacy, Elder Care, HR Tech, Health & Wellness, Mobile, SaaS, Quality Assurance, Advertising, AdTech, Marketing, MarTech, Entertainment, Media, Big Data, Analytics, Manufacturing, Marketplace, Industrials, FinTech, Events, Food and Beverage, RestaurantTech, Computer, SpaceTech, Enterprise, Service Industry, Construction, Tech, Productivity, Tools"
Investor Name,Fund Type,Fund Stage,Website (if available),"Fund, Focus, Sectors"
Revolution Ventures,Venture Fund,"SeedSeries A,Series B",https://www.revolution.com,"E-Commerce, Consumer, RetailTech, Advertising, AdTech, Marketing, MarTech, Mobile, EdTech, SaaS, Software, Quality Assurance, Service Industry, Food and Beverage, B2B, Information Technology, Entertainment, Media, Construction, Tech, Productivity"
"Revolution’s Rise of the Rest
Seed Fund",Accelerator,Seed,"https://www.revolution.com/
entity/rotr/","EdTech, Software, Artificial Intelligence, Machine Learning, AI, ML, Hardware, Energy, IoT, Internet of Things, PropTech, Delivery, Information Technology, SaaS, Sales, Cybersecurity, Elder Care, HR Tech, Healthcare, Health & Wellness, InsurTech, FinTech, Mobile, Advertising, AdTech, Big Data, Analytics, Entertainment, Media, Marketing, MarTech, Manufacturing, Marketplace, Food and Beverage, Hospitality, Events, Professional Services, Construction, Tech, E-Commerce, Consumer, Enterprise, RetailTech, Supply Chain"
Rhapsody Venture Partners,Venture Fund,"Pre-SeedSeed,Series A",www.rhapsodyvp.com,"Hardware, Artificial Intelligence, Machine Learning, AI, ML, Transportation, Software"
Rho Canada Ventures,Venture Fund,"Pre-SeedSeed,Series ASeries B,Series CSeries D",www.rhocanada.com,"Software, Mobile, SaaS, Consumer, FinTech"
Rho Capital Partners,Venture Fund,"Pre-SeedSeed,Series ASeries B,Series CSeries D",www.rho.com,"FinTech, RetailTech, SaaS"
Rho Ventures,Venture Fund,"Pre-SeedSeed,Series ASeries B,Series CSeries D",www.rhoventures.com,"E-Sports, Gaming, Infrastructure, Healthcare, SaaS, Telecommunications, TMT"
Ribbit Capital,Venture Fund,"Pre-SeedSeed,Series ASeries B,Series CSeries D",www.ribbitcap.com,"Cryptocurrency, Blockchain, FinTech, InsurTech, Mobile, Telecommunications, TMT"
Investor Name,Fund Type,Fund Stage,Website (if available),"Fund, Focus, Sectors"
Rice Park Capital Management,Venture Fund,"SeedSeries A,Series B",https://riceparkcapital.com/,"Artificial Intelligence, Machine Learning, AI, ML, Customer Service, Information Technology, SaaS, Software"
Ridge Ventures,Venture Fund,"Pre-SeedSeed,Series A",www.ridge.vc,"SaaS, Telecommunications, TMT"
Ridgeline Partners,Venture Fund,"Pre-SeedSeed,Series ASeries B,Series C",https://ridgelinepartners.co,"Artificial Intelligence, Machine Learning, AI, ML, Big Data, Analytics, Logistics, Software, Enterprise"
Ridgeline Ventures,Venture Fund,"SeedSeries A,Series BSeries C,Series D",http://ridgelinevc.com,"Sports, RetailTech"
Right Side Capital Management,Venture Fund,Seed,http://rightsidecapital.com/,"B2B, SaaS, Software, Enterprise, HR Tech, Information Technology, PropTech, Marketing, MarTech, CRM, E-Commerce, Artificial Intelligence, Machine Learning, AI, ML, Big Data, Analytics, Mobile, Parenting, Ridesharing, Delivery, Transportation, Telecommunications, TMT, Developer Tools, InsurTech, Cryptocurrency, Blockchain, FinTech, RetailTech, Healthcare, Computer, Hospitality, Travel, Advertising, AdTech, Consumer, IoT, Internet of Things, Food and Beverage, RestaurantTech, ClimateTech, CleanTech, Robotics, Legal Tech, Professional Services, Entertainment, Media, Meeting Software, CloudTech, Market Research, Productivity, Sales, Marketplace, Beauty, Fashion, Creator Economy, E-Sports, Gaming, GovTech, Logistics, Hardware, Construction, Tech, Network Security, Risk Management, Elder Care, Sports, EdTech, Pharmaceuticals, Health & Wellness, Supply Chain, Quality Assurance, AgTech, FarmTech, PetTech"
RightVentures,Venture Fund,Seed,www.rightventures.com,"Software, Mobile, SaaS, Consumer, FinTech"
Investor Name,Fund Type,Fund Stage,Website (if available),"Fund, Focus, Sectors"
Riot Ventures,Venture Fund,"Pre-SeedSeed,Series ASeries B,Series CSeries D",www.riot.vc,"CloudTech, Computer, Enterprise, Hardware, Information Technology, Software"
Ripple,Venture Fund,"SeedSeries A,Series B",http://ripple.com,"Cryptocurrency, Blockchain, FinTech, Information, Technology"
River Cities Capital,Venture Fund,"Series BSeries C,Series D",www.rccf.com,"Big Data, Analytics, Developer Tools, Information Technology, Software, Artificial Intelligence, Machine Learning, AI, ML, CRM, Marketing, MarTech, BioTech, Healthcare, Mobile, Infrastructure"
Riverbend Capital,Venture Fund,"SeedSeries A,Series B",https://riverbend.vc/,"Artificial Intelligence, Machine Learning, AI, ML, Healthcare, Big Data, Analytics"
Riverside Acceleration Capital,Venture Fund,"Pre-SeedSeed,Series A",www.riverside.ac,"Marketing, MarTech, SaaS, Sales, Software, HR Tech, Healthcare, InsurTech, Information Technology, Construction, Tech, Enterprise, Productivity"
Riverstone Holdings,Venture Fund,"Series CSeries D,Series B",http://www.riverstonellc.com,"Energy, Advanced Materials, Transportation, Nanotechnology, IoT, Internet of Things, Manufacturing, ClimateTech, CleanTech, Big Data, Analytics, FinTech, SaaS, Artificial Intelligence, Machine Learning, AI, ML, Quality Assurance, AgTech, FarmTech, BioTech, Food, Beverage"
Riverwood Capital,Venture Fund,Series CSeries D,"http://www.riverwoodcapital.
com","Collaboration, Community, Enterprise, SaaS, CloudTech, Computer, FinTech, Information Technology, Software"
RLC Ventures,Venture Fund,"SeedSeries A,Series B",https://rlc.ventures/,"B2B, Marketing, MarTech, SaaS, Sales, Software"
Roble Ventures,Venture Fund,"SeedSeries A,Series B",https://robleventures.com/,"E-Commerce, EdTech, Mobile, SaaS"
Rock Creek Capital,Venture Fund,"SeedSeries A,Series B",https://rockcreekcapllc.com/,"Big Data, Analytics, Artificial Intelligence, Machine Learning, AI, ML, Information, Technology"
Investor Name,Fund Type,Fund Stage,Website (if available),"Fund, Focus, Sectors"
rocketship.vc,Venture Fund,"Pre-SeedSeed,Series A",www.rocketship.vc,"FinTech, InsurTech, CloudTech, Big Data, Analytics, Information Technology, Artificial Intelligence, Machine Learning, AI, ML, Software, RetailTech, Events, Entertainment, Media, PoS, Point of Sale, RestaurantTech, Developer Tools"
Rockies Venture Club,Angel Network,"SeedSeries A,Series B","http://www.rockiesventurecl
ub.org","Entertainment, Media, Creator Economy, Software, Healthcare, Mobile"
RockPort Capital,Venture Fund,"Pre-SeedSeed,Series ASeries B,Series CSeries D",www.rockportcap.com,"Software, Mobile, SaaS, Consumer, FinTech"
Rogue Venture Partners,Venture Fund,"SeedSeries A,Series B",http://roguevp.com,"Mobile, Community, Consumer, Marketing, MarTech, Entertainment, Media, Outdoors, Software, Travel"
Romulus Capital,Venture Fund,"Pre-SeedSeed,Series A",www.romuluscap.com,"Healthcare, InsurTech, AgTech, FarmTech, Big Data, Analytics, Robotics, Artificial Intelligence, Machine Learning, AI, ML, Advertising, AdTech, Marketing, MarTech, PropTech, Creator Economy, E-Commerce, Entertainment, Media, RetailTech, Software, Construction, Tech, Infrastructure, Saa, S"
Root and Shoot Ventures,Venture Fund,"Pre-SeedSeed,Series A",www.rs.ventures,"Software, Mobile, SaaS, Consumer, FinTech"
Root Ventures,Venture Fund,"Pre-SeedSeed,Series A",www.root.vc,"Manufacturing, Robotics, Telecommunications, TMT"
Rose Park Advisors,Venture Fund,"Pre-SeedSeed,Series ASeries B,Series CSeries D",www.roseparkadvisors.com,"Healthcare, Telecommunications, TMT"
Rose Tech Ventures,Accelerator,"SeedSeries A,Series BSeries C,Series D",http://rose.vc,"E-Commerce, FinTech, Mobile, SaaS"
Rosecliff Ventures,Venture Fund,"Pre-SeedSeed,Series ASeries B,Series CSeries D",www.rosecliff.com,"Beauty, Healthcare, Consumer, Food and Beverage, Manufacturing, FemTech"
Investor Name,Fund Type,Fund Stage,Website (if available),"Fund, Focus, Sectors"
"Rosemoor Capital Management
LLC",Venture Fund,"SeedSeries A,Series BSeries C,Series D","http://www.rosemoorcapital.
com","Cryptocurrency, Blockchain, FinTech"
Route 66 Ventures,Venture Fund,"Pre-SeedSeed,Series ASeries B,Series CSeries D",www.route66ventures.com,"FinTech, PropTech, BioTech, Consumer, Food and Beverage, ClimateTech, CleanTech"
RPS Ventures,Venture Fund,Series CSeries D,"https://www.rpsventures.co
m","Artificial Intelligence, Machine Learning, AI, ML, InsurTech, Big Data, Analytics, PropTech"
RRE Ventures,Venture Fund,"Pre-SeedSeed,Series ASeries B,Series CSeries D",www.rre.com,"Big Data, Analytics, FinTech, Software, Cryptocurrency, Blockchain, Healthcare, Health & Wellness, Customer Service, IoT, Internet of Things, PropTech, Marketplace, Hardware, Transportation, Artificial Intelligence, Machine Learning, AI, ML, Simulation, E-Commerce, Consumer, RetailTech, EdTech, Developer Tools, B2B, Quality Assurance, Robotics, Information, Technology"
RTP Global,Venture Fund,"SeedSeries A,Series B",https://rtp.vc/,"Artificial Intelligence, Machine Learning, AI, ML, EdTech, Enterprise, Information Technology, Big Data, Analytics, HR Tech, Productivity, Computer, CloudTech, Software, FinTech"
RTP Ventures,Venture Fund,"Pre-SeedSeed,Series A",www.rtp.vc,"Software, Mobile, SaaS, Consumer, FinTech"
Rucker Park Capital,Venture Fund,"Pre-SeedSeed,Series A",www.rpvc.com,"Software, Mobile, SaaS, Consumer, FinTech"
Runa Capital,Venture Fund,"Pre-SeedSeed,Series ASeries B,Series CSeries D",www.runacap.com,"Cybersecurity, Risk Management, SaaS, Artificial Intelligence, Machine Learning, AI, ML, Software, Enterprise, Infrastructure, Big Data, Analytics, Developer Tools, Information Technology, Marketing, MarTech, FinTech, RestaurantTech, CloudTech, CRM"
Runway Venture Partners,Venture Fund,"Pre-SeedSeed,Series A",www.runwayvp.com,"Information Technology, Enterprise, E-Commerce, RetailTech, Software, Supply Chain, Tech"
Investor Name,Fund Type,Fund Stage,Website (if available),"Fund, Focus, Sectors"
Rustic Canyon Partners,Venture Fund,"Pre-SeedSeed,Series ASeries B,Series CSeries D",www.rusticcanyon.com,"Healthcare, Health & Wellness"
S Capital,Venture Fund,SeedSeries A,https://scapitalvc.com/,"FinTech, HR Tech, InsurTech, Software"
S-Cubed Capital,Venture Fund,"Pre-SeedSeed,Series A",www.scubedcap.com,"Software, Mobile, SaaS, Consumer, FinTech"
S2 Capital,Venture Fund,"Pre-SeedSeed,Series A",www.s2capital.vc,"Software, Mobile, SaaS, Consumer, FinTech"
S3 Ventures,Venture Fund,"Pre-SeedSeed,Series ASeries B,Series CSeries D",www.S3vc.com,"B2B, Information Technology, Software, CloudTech, Construction, Tech, FinTech, SaaS, Big Data, Analytics, Developer Tools, Healthcare, Sales, Mobile, Delivery, Logistics, RestaurantTech, Health & Wellness"
S28 Capital,Venture Fund,"Pre-SeedSeed,Series A",www.S28capital.com,"CloudTech, Collaboration, Productivity, Big Data, Analytics, Information Technology, Infrastructure, Software, SaaS, Customer Service, Marketing, MarTech, Sales, Advertising, AdTech, Artificial Intelligence, Machine Learning, AI, ML, E-Commerce"
Saama Capital,Venture Fund,"SeedSeries A,Series BSeries C,Series D",http://www.saamacapital.vc,"Software, CloudTech, Cybersecurity"
SaaS Ventures,Venture Fund,"Pre-SeedSeed,Series A",www.saasventurecapital.com,"Big Data, Analytics, IoT, Internet of Things, SaaS"
SaaStr Fund,Venture Fund,"SeedSeries A,Series B",http://www.saastrfund.com/,"FinTech, Developer Tools"
SAATCHiNVEST,Venture Fund,"SeedSeries A,Series B",http://saatchinvest.co.uk/,"Artificial Intelligence, Machine Learning, AI, ML, Collaboration, Telecommunications, TMT, Creator Economy, Virtual Reality, AR/VR"
Safar Partners,Venture Fund,"Pre-SeedSeed,Series ASeries B,Series CSeries D",www.safar.partners,"Manufacturing, Artificial Intelligence, Machine Learning, AI, ML, ClimateTech, CleanTech, Healthcare, Life Science, SaaS, Telecommunications, TMT"
Investor Name,Fund Type,Fund Stage,Website (if available),"Fund, Focus, Sectors"
Sageview Capital,Venture Fund,"SeedSeries A,Series BSeries C,Pre-Seed","http://www.sageviewcapital.c
om","Advertising, AdTech, Big Data, Analytics, Marketing, MarTech, SaaS, Consumer, CRM, Information Technology, Market Research, Artificial Intelligence, Machine Learning, AI, ML, Software, Quality Assurance, CloudTech, Infrastructure, Enterprise, IoT, Internet of Things, Mobile, RetailTech, AgTech, FarmTech, Supply Chain, Tech, FinTech"
SAIF Partners,Venture Fund,"SeedSeries A,Series BSeries C,Series DPre-Seed",http://www.sbaif.com,"FinTech, Construction, Tech, Robotics, Infrastructure, ClimateTech, CleanTech, SaaS, Software, Productivity, Enterprise, Information Technology"
Saints Capital,Venture Fund,"Pre-SeedSeed,Series ASeries B,Series CSeries D",www.saintscapital.com,"Life Science, Manufacturing, SaaS, Telecommunications, TMT"
Saisei Ventures,Venture Fund,"SeedSeries A,Series BSeries C,Series D","https://www.saiseiventures.c
om/",Healthcare
Salesforce,Venture Fund,"Pre-SeedSeed,Series A",www.salesforce.com,"Developer Tools, Enterprise, SaaS, Hardware, Computer, Information Technology, Software, B2B, B2C, Professional Services, FinTech, Hospitality"
Salkantay Ventures,Venture Fund,"SeedSeries A,Series B",https://www.salkantay.vc/,"Future of Work, HR Tech, Entertainment, Media"
Salveo Capital,Venture Fund,"SeedSeries A,Series B","http://www.salveocapital.co
m/","AgTech, FarmTech, Software"
Samsara BioCapital,Venture Fund,"Pre-SeedSeed,Series ASeries B,Series CSeries D",www.samsaracap.com,"BioTech, Pharmaceuticals, Healthcare, Life Science"
Investor Name,Fund Type,Fund Stage,Website (if available),"Fund, Focus, Sectors"
Sandalphon Capital,Venture Fund,"SeedSeries A,Series B","http://sandalphoncapital.co
m","Manufacturing, AgTech, FarmTech, Artificial Intelligence, Machine Learning, AI, ML, FinTech, CloudTech, Construction, Tech, Healthcare, E-Commerce, EdTech, E-Sports, Gaming, RestaurantTech, HR Tech, Infrastructure, InsurTech, IoT, Internet of Things, Legal Tech, Marketing, MarTech, PropTech, PetTech, Robotics, SaaS, SpaceTech, Supply Chain, Telecommunications, TMT"
Sandbox Industries,Accelerator,"Pre-SeedSeed,Series ASeries B,Series CSeries D",www.sandboxindustries.com,"Artificial Intelligence, Machine Learning, AI, ML, Healthcare, Big Data, Analytics, Risk Management, Information Technology, Health & Wellness, InsurTech, FinTech"
Sandbridge Capital,Venture Fund,"SeedSeries A,Series B",http://sandbridgecap.com/,Beauty
Sante Ventures,Venture Fund,"Pre-SeedSeed,Series ASeries B,Series CSeries D",www.sante.com,"Healthcare, Telecommunications, TMT, Health & Wellness, BioTech, Pharmaceuticals"
Sapphire Ventures,Venture Fund,"Pre-SeedSeed,Series ASeries B,Series CSeries D",www.sapphireventures.com,"Artificial Intelligence, Machine Learning, AI, ML, FinTech, Big Data, Analytics, ClimateTech, CleanTech, CloudTech, Cryptocurrency, Blockchain, Cybersecurity, Healthcare, E-Sports, Gaming, HR Tech, InsurTech, Legal Tech, Marketing, MarTech, PropTech, SaaS, Supply Chain, Tech, Telecommunications, TMT"
Scale Asia Ventures,Venture Fund,"Pre-SeedSeed,Series A",www.sav.vc,"Artificial Intelligence, Machine Learning, AI, ML, Big Data, Analytics, Cryptocurrency, Blockchain, Cybersecurity, EdTech, FinTech, Infrastructure, InsurTech, Life Science, PropTech, SaaS, Telecommunications, TMT"
Investor Name,Fund Type,Fund Stage,Website (if available),"Fund, Focus, Sectors"
Scale Venture Partners,Venture Fund,"Pre-SeedSeed,Series A",www.scalevp.com,"CloudTech, Cybersecurity, SaaS, Artificial Intelligence, Machine Learning, AI, ML, Customer Service, Information Technology, Logistics, Software, Supply Chain, Tech, Enterprise, Infrastructure, Advertising, AdTech, Big Data, Analytics, Marketing, MarTech, Construction, PropTech, Robotics, Risk Management, Healthcare, Network Security, E-Commerce, Mobile, Hardware, EdTech, Future of Work, Quality Assurance, B2B, Sales, Developer Tools, FinTech, InsurTech"
Schematic Ventures,Venture Fund,"Pre-SeedSeed,Series A",www.schematicventures.com,"Manufacturing, Infrastructure, Supply Chain, Tech"
Science,Venture Fund,"SeedSeries A,Series B",http://www.science-inc.com,"Advertising, AdTech, Big Data, Analytics, Cryptocurrency, Blockchain, E-Commerce, EdTech, E-Sports, Gaming, FinTech, RestaurantTech, IoT, Internet of Things, Marketing, MarTech, Telecommunications, TMT"
SciFi VC,Venture Fund,"Pre-SeedSeed,Series A",www.scifi.vc,"Healthcare, Marketplace, FinTech, InsurTech, SaaS, Software, Community, E-Commerce, RetailTech, Marketing, MarTech, BioTech, Information Technology, Developer Tools"
