Investor Name,Fund Type,Fund Stage,Website,Fund Focus (Sectors)
.406 Ventures,Venture Fund,Seed,www.406ventures.com,"Software, Cybersecurity, Healthcare, Big Data, Analytics"
01 Advisors,Venture Fund,"Pre-SeedSeed,Series A",www.01a.com,"Cryptocurrency, Blockchain, Entertainment, Media, Sports, Artificial Intelligence, Machine Learning, AI, ML, FinTech, InsurTech, Big Data, Analytics, Hospitality, SaaS, Travel"
1/0 Capital,Venture Fund,"Series A Series B,Series CSeries D",www.onezerocapital.com,"Software, Mobile, SaaS, Consumer, FinTech"
1confirmation,Venture Fund,"SeedSeries A,Series B","http://www.1confirmation.co
m/","Cryptocurrency, Blockchain, Information Technology"
2.12 Angels,Venture Fund,Seed,www.212angels.com,"Developer Tools, Professional Services"
3ig Ventures,Venture Fund,"SeedSeries A,Series B","https://www.3igventures.co
m/","Cryptocurrency, Blockchain, E-Commerce, FinTech, Healthcare, Impact Investing"
3L Capital,Venture Fund,"SeedSeries A,Series BSeries C,Series D",https://www.3lcap.com/,"PropTech, Software, Enterprise, Logistics, InsurTech, Privacy, SaaS, Transportation, E-Commerce"
3Lines,Venture Fund,"Pre-SeedSeed,Series A",www.3lines.vc,"ClimateTech, CleanTech, Software, Energy, Industrials, Manufacturing, Developer Tools, Transportation"
3one4 Capital,Venture Fund,"SeedSeries A,Series B","http://www.3one4capital.co
m/","Mobile, EdTech, FinTech, Sales, Software"
3VC,Venture Fund,"SeedSeries A,Series B",https://www.three.vc/,"Healthcare, Artificial Intelligence, Machine Learning, AI, ML, Collaboration, Developer Tools, SaaS, Professional, Services"
4BIO Capital,Venture Fund,"SeedSeries A,Series BSeries C,Series D",http://www.4biocapital.com,"BioTech, Healthcare, Life Science"
4DX Ventures,Venture Fund,"Pre-SeedSeed,Series A","https://www.4dxventures.co
m","FinTech, SpaceTech, Telecommunications, TMT, IoT, Internet of Things"
5AM Ventures,Venture Fund,"Pre-SeedSeed,Series ASeries B,Series CSeries D",www.5amventures.com,"BioTech, Life Science, Healthcare, Advanced Materials, Consumer, Hardware, Industrials, Manufacturing, PropTech, IoT, Internet of Things"
6th Man Ventures,Venture Fund,"Pre-SeedSeed,Series A",www.6thman.ventures,"Cryptocurrency, Blockchain, Software"
7BC Venture Capital,Venture Fund,SeedSeries A,https://7BC.VC,"Artificial Intelligence, Machine Learning, AI, ML, Cryptocurrency, Blockchain, FinTech, IoT, Internet of Things, SaaS, Telecommunications, TMT"
7percent Ventures,Venture Fund,"SeedSeries A,Series B",http://7pc.co,"AgTech, FarmTech, Food and Beverage, PropTech, ClimateTech, CleanTech, Robotics, Consumer, Entertainment, Media, Information Technology, Software, Creator Economy, SpaceTech, Big Data, Analytics, IoT, Internet of Things"
7thirty Capital,Venture Fund,"SeedSeries A,Series B",https://7thirtycapital.com/,"AgTech, FarmTech, Enterprise, Software, Supply Chain, Tech"
7wire Ventures,Venture Fund,"Pre-SeedSeed,Series A",www.7wireventures.com,"Elder Care, Healthcare, Professional Services, Service Industry, Software, FinTech, Health & Wellness, Mobile, EdTech, Big Data, Analytics, Information Technology, BioTech, H, Tech"
8VC,Venture Fund,"Pre-SeedSeed,Series A",www.8vc.com,"Manufacturing, FinTech, ClimateTech, CleanTech, Healthcare, EdTech, Infrastructure, Mobile, PropTech, SaaS, Telecommunications, TMT"
9Unicorns Accelerator Fund,Accelerator,"SeedSeries A,Series B",https://www.9unicorns.in/,"Consumer, Health & Wellness, Fin, Tech"
9Yards Capital,Venture Fund,"Series BSeries C,Series D",www.9yardscapital.com,"Manufacturing, B2B, FinTech, Healthcare, Micro-Mobility, SaaS, Supply Chain, Tech, Telecommunications, TMT"
10Branch,Family Office,Series B Series C,http://www.10branch.com,"FinTech, SaaS, Cryptocurrency, Blockchain, Advertising, AdTech, Big Data, Analytics, PropTech, Manufacturing, Artificial Intelligence, Machine Learning, AI, ML, Virtual Reality, AR/VR, Developer Tools, AgTech, FarmTech, AudioTech, B2C, Beauty, B2B, Bio, Tech, Black, African, American, Founded, Cannabis, ClimateTech, CleanTech, Productivity, CloudTech, Cloud, Security, Construction, Infrastructure, Consumer, Creator Economy, CRM, Hardware, Cybersecurity, Wearables, Quantified Self, Customer Service, D2C, DeepTech, Healthcare, Entertainment, Media, E-Commerce, EdTech, HR Tech, Energy, Enterprise, E-Sports, Gaming, Events, FemTech, Food and Beverage, RestaurantTech, Future of Work, GovTech, Impact Investing, Information Technology, InsurTech, IoT, Internet of Things, Telecommunications, TMT, Mobile, Legal Tech, Life Science, Marketing, MarTech, Logistics, Marketplace, Meeting Software, Micro-Mobility, Network Security, Neuroscience, Oil & Gas, Travel, PaaS, PetTech, Pharmaceuticals, Recruiting, RetailTech, Robotics, Sales, Ridesharing, Sharing Economy, Social Media, Sports, Supply Chain, Sustainability, Women-Founded, Transportation, SpaceTech, Software"
10T Holdings,Venture Fund,Series CSeries D,www.10tfund.com,"Cryptocurrency, Blockchain"
10X Capital,Venture Fund,Series CSeries D,www.10xcapital.com,"Big Data, Analytics, FinTech, Marketplace, Healthcare"
10x Group,Venture Fund,"SeedSeries A,Series BSeries C,Series D",http://10x.group/,"E-Commerce, Marketplace, Hospitality, Travel, Consumer, FinTech, RetailTech"
10x Value Partners,Venture Fund,"SeedSeries A,Series B",http://10xvaluepartners.com/,E-Commerce
Investor Name,Fund Type,Fund Stage,Website (if available),"Fund, Focus, Sectors"
12/12 Ventures,Venture Fund,"SeedSeries A,Series B",https://www.1212.vc,"Information Technology, SaaS, Software"
14W,Venture Fund,"Pre-SeedSeed,Series ASeries B,Series CSeries D",www.14w.com,"Artificial Intelligence, Machine Learning, AI, ML, Entertainment, Media, Software, E-Commerce, Fashion, Manufacturing, Beauty, Healthcare, RetailTech"
40 North Ventures,Venture Fund,"Pre-SeedSeed,Series A",www.40northventures.com,"Software, Mobile, SaaS, Consumer, FinTech"
43North,Accelerator,"SeedSeries A,Series B",http://www.43north.org/,"Events, PropTech, FinTech, E-Commerce, Marketplace"
75 & Sunny,Venture Fund,"SeedSeries A,Series B",http://75andsunny.vc,"Big Data, Analytics, HR Tech, Software, Advertising, AdTech, PropTech, Travel, SpaceTech, ClimateTech, CleanTech, Energy"
83North,Venture Fund,"SeedSeries A,Series BSeries C,Series D",http://www.83north.com,"Big Data, Analytics, Information Technology, Artificial Intelligence, Machine Learning, AI, ML, Software, CloudTech, HR Tech, SaaS, Enterprise, Computer, Cybersecurity, B2B, Entertainment, Media, Marketing, MarTech, Advertising, AdTech, Developer Tools, Infrastructure, FinTech, PropTech"
111° West Capital,Venture Fund,"SeedSeries A,Series BSeries C",https://111westcapital.com/,"BioTech, Healthcare, Pharmaceuticals"
137 Ventures,Venture Fund,"Series ASeries B,Series C",www.137ventures.com,"Software, DeepTech"
408 Ventures,Venture Fund,"Pre-SeedSeed,Series A",www.408ventures.com,"Software, Mobile, SaaS, Consumer, FinTech"
468 Capital,Venture Fund,SeedSeries A,https://www.468cap.com/,"Cryptocurrency, Blockchain, Information Technology, Artificial Intelligence, Machine Learning, AI, ML, CloudTech, Big Data, Analytics, Collaboration, Software, Legal Tech, EdTech, FinTech, IoT, Internet of Things"
500 Global,Venture Fund,"Pre-SeedSeed,Series A",www.500.co,"AgTech, FarmTech, AudioTech, Big Data, Analytics, E-Commerce, FinTech, IoT, Internet of Things, Mobile, SaaS, Telecommunications, TMT"
Investor Name,Fund Type,Fund Stage,Website (if available),"Fund, Focus, Sectors"
500 Startups,Venture Fund,"SeedSeries A,Series B",http://500.co,"FinTech, Healthcare, Information Technology, Marketing, MarTech, SaaS, Sales, Software, B2B, Collaboration, Enterprise, Energy, ClimateTech, CleanTech, Travel, Delivery, E-Commerce, Food and Beverage, CloudTech, Entertainment, Media, Developer Tools, PaaS, Productivity, Computer, InsurTech, Consumer, Marketplace, CRM, Community, B2C, Cybersecurity, Beauty, Mobile, RetailTech, Artificial Intelligence, Machine Learning, AI, ML, Big Data, Analytics, BioTech, Pharmaceuticals, Parenting, Advertising, AdTech, Transportation, PoS, Point of Sale, PropTech, EdTech, HR Tech, IoT, Internet of Things, Customer Service, Health & Wellness, Hardware, Wearables, Quantified Self, Service Industry, Quality Assurance, Emerging Markets, E-Sports, Gaming, Creator Economy, Life Science, Fashion, Legal Tech, Professional Services, Logistics, Market Research, Virtual Reality, AR/VR, Cryptocurrency, Blockchain, Infrastructure, Events, FemTech, Manufacturing, Risk Management, AgTech, FarmTech, Robotics, Sports, RestaurantTech, SpaceTech, Telecommunications, TMT"
500 Startups Japan,Venture Fund,"Pre-SeedSeed,Series A",www.500startups.jp,"Software, Mobile, SaaS, Consumer, FinTech"
500 Startups Vietnam,Venture Fund,Seed,http://vietnam.500.co/,"Healthcare, Life Science, Wearables, Quantified Self, FinTech, Software"
640 Oxford Ventures,Venture Fund,"SeedSeries A,Series B","https://www.640oxfordventu
res.com/","Consumer, B2B"
645 Ventures,Venture Fund,SeedSeries A,www.645ventures.com,"SaaS, Infrastructure, Consumer"
840 Venture Partners,Venture Fund,"Series ASeries B,Series C",https://840vp.com/,"FinTech, Future of Work, Big Data, Analytics"
1414 Ventures,Venture Fund,Pre-SeedSeed,"https://www.1414ventures.co
m/","Cybersecurity, FinTech, Software"
1517 Fund,Venture Fund,"Pre-SeedSeed,Series A",www.1517fund.com,"Hardware, Manufacturing, Software, Artificial Intelligence, Machine Learning, AI, ML, E-Commerce, Marketplace, RetailTech, ClimateTech, CleanTech, Logistics, Supply Chain, Tech, SpaceTech, Consumer, Fashion, CloudTech, FinTech"
1809 Capital,Venture Fund,"Series BSeries C,Series D","https://www.1809capital.com
/",Healthcare
1843 Capital,Venture Fund,"SeedSeries A,Series B",http://1843capital.com,"Elder Care, HR Tech, Healthcare, Information Technology, Health & Wellness, CloudTech, Cybersecurity, SaaS"
1863 Ventures,Venture Fund,Pre-SeedSeed,https://1863ventures.net/,"Beauty, Healthcare, E-Commerce, EdTech, FinTech, RestaurantTech, HR Tech, Impact Investing"
1984 Ventures,Venture Fund,"SeedSeries A,Series B",http://1984.vc,"PropTech, Information Technology, Mobile, SaaS, Software, HR Tech, Healthcare, Consumer, Logistics, Supply Chain, Tech, Computer, FinTech, Big Data, Analytics, Developer Tools, Delivery, Food, Beverage, Artificial Intelligence, Machine Learning, AI, ML, Enterprise, Productivity"
2048 Ventures,Venture Fund,"SeedSeries A,Series B",https://www.2048.vc,"Artificial Intelligence, Machine Learning, AI, ML, E-Commerce, Marketplace, RetailTech, ClimateTech, CleanTech, Big Data, Analytics, B2B, SaaS, Software, Developer Tools, FinTech, Consumer, Information Technology, Food and Beverage, Healthcare, Marketing, MarTech, Entertainment, Media, Creator Economy, Customer Service, Hospitality, Restaurant, Tech"
2150,Venture Fund,"SeedSeries A,Series BSeries C,Series D",https://2150.vc,"Big Data, Analytics, Developer Tools, FinTech, GovTech, SaaS, IoT, Internet of Things, BioTech, Advanced Materials, Industrials"
8090 Partners,Venture Fund,"Pre-SeedSeed,Series A",www.8090partners.com,"Software, Mobile, SaaS, Consumer, FinTech"
Investor Name,Fund Type,Fund Stage,Website (if available),"Fund, Focus, Sectors"
A Capital,Venture Fund,SeedSeries A,www.acapital.com,"Consumer, Enterprise, Software"
A-Level Capital,Venture Fund,Seed,www.alevelcapital.com,"Software, Mobile, SaaS, Consumer, FinTech"
A. M. Pappas & Associates,Venture Fund,"Pre-SeedSeed,Series A",www.ampappas.com,"Software, Mobile, SaaS, Consumer, FinTech"
A.Capital Ventures,Venture Fund,"SeedSeries A,Series B",http://www.acapital.com,"Artificial Intelligence, Machine Learning, AI, ML, Robotics, Software, Big Data, Analytics, CRM, Information Technology, SaaS, Sales, B2B, Developer Tools, Mobile, CloudTech, FinTech, Health & Wellness, Healthcare, InsurTech, Cryptocurrency, Blockchain, ClimateTech, CleanTech, E-Commerce, Entertainment, Media, Transportation, Computer, Cybersecurity"
A'Z Angels,Venture Fund,"Pre-SeedSeed,Series A",www.azangels.vc,"Software, Mobile, SaaS, Consumer, FinTech"
Investor Name,Fund Type,Fund Stage,Website (if available),"Fund, Focus, Sectors"
A* Capital,Venture Fund,"SeedSeries A,Series BSeries C,Series D",www.a-star.co,"FinTech, SaaS, Cryptocurrency, Blockchain, Advertising, AdTech, Big Data, Analytics, PropTech, Manufacturing, Artificial Intelligence, Machine Learning, AI, ML, Virtual Reality, AR/VR, Developer Tools, AgTech, FarmTech, AudioTech, B2C, Beauty, B2B, Bio, Tech, Black, African, American, Founded, Cannabis, ClimateTech, CleanTech, Productivity, CloudTech, Cloud, Security, Construction, Infrastructure, Consumer, Creator Economy, CRM, Hardware, Cybersecurity, Wearables, Quantified Self, Customer Service, D2C, DeepTech, Healthcare, Entertainment, Media, E-Commerce, EdTech, HR Tech, Energy, Enterprise, E-Sports, Gaming, Events, FemTech, Food and Beverage, RestaurantTech, Future of Work, GovTech, Impact Investing, Information Technology, InsurTech, IoT, Internet of Things, Telecommunications, TMT, Mobile, Legal Tech, Life Science, Marketing, MarTech, Logistics, Marketplace, Meeting Software, Micro-Mobility, Network Security, Neuroscience, Oil & Gas, Travel, PaaS, PetTech, Pharmaceuticals, Recruiting, RetailTech, Robotics, Sales, Ridesharing, Sharing Economy, Social Media, Sports, Supply Chain, Sustainability, Women-Founded, Transportation, SpaceTech, Software"
AAF Management Ltd.,Venture Fund,"Pre-SeedSeed,Series A",www.aaf.vc,"Advertising, AdTech, Big Data, Analytics, Marketing, MarTech, Software, Healthcare, Artificial Intelligence, Machine Learning, AI, ML, Cryptocurrency, Blockchain, FinTech, Consumer, E-Sports, Gaming, Developer Tools, Information, Technology"
Investor Name,Fund Type,Fund Stage,Website (if available),"Fund, Focus, Sectors"
ABB,Corporate VC,Series CSeries D,https://global.abb/group/en,"CloudTech, Hardware, Information Technology, IoT, Internet of Things, Software"
AbbVie,Corporate VC,"Series CSeries D,Series B",http://www.abbvie.com,"BioTech, Healthcare"
AbCellera Biologics,Venture Fund,"Series BSeries C,Series D",https://www.abcellera.com/,"BioTech, PetTech"
Aberdare Ventures,Venture Fund,"Pre-SeedSeed,Series ASeries B,Series CSeries D",www.aberdare.com,"Healthcare, InsurTech"
Abingworth,Venture Fund,"SeedSeries A,Series BSeries C,Series D",http://www.abingworth.com,"BioTech, Healthcare"
Able Partners,Venture Fund,"Pre-SeedSeed,Series A",www.ablepartners.nyc,"Consumer, E-Commerce, Artificial Intelligence, Machine Learning, AI, ML, BioTech, Healthcare, Life Science, Parenting, EdTech, Professional Services, Community, PaaS, CRM, Information Technology, Software, Health, Wellness"
ABRY Partners,Venture Fund,"SeedSeries A,Series B",http://www.abry.com,"BioTech, Health & Wellness, Healthcare, GovTech, SaaS, Software, Entertainment, Media"
ABS Capital Partners,Venture Fund,"Pre-SeedSeed,Series ASeries B,Series CSeries D",www.abscapital.com,"Advertising, AdTech, Big Data, Analytics, Marketing, MarTech, Software, Creator Economy, B2B, Entertainment, Media, E-Commerce, Marketplace, Mobile, CloudTech, Cybersecurity, Information Technology, Transportation"
Abstract,Corporate VC,Pre-SeedSeed,https://www.abstract.com/,"Collaboration, CRM, Productivity, Software"
Acacia Venture Partners,Venture Fund,"Pre-SeedSeed,Series A",www.acaciavp.com,"Software, Mobile, SaaS, Consumer, FinTech"
Investor Name,Fund Type,Fund Stage,Website (if available),"Fund, Focus, Sectors"
Academy Investor Network,Venture Fund,"SeedSeries A,Series CSeries D,Series B","https://www.academyinvesto
r.com/","Manufacturing, Artificial Intelligence, Machine Learning, AI, ML, ClimateTech, CleanTech, CloudTech, Cybersecurity, Healthcare, E-Commerce, IoT, Internet of Things, Life Science, Robotics, SaaS, SpaceTech, Virtual Reality, AR/VR"
Accel,Venture Fund,"Pre-SeedSeed,Series ASeries B,Series CSeries D",www.accel.com,"Professional Services, Enterprise, Information Technology, Risk Management, FinTech, InsurTech, Big Data, Analytics, Marketing, MarTech, Mobile, SaaS, Artificial Intelligence, Machine Learning, AI, ML, B2B, CRM, Sales, Software, EdTech, Community, Entertainment, Media, CloudTech, Cybersecurity, Collaboration, Consumer, Beauty, E-Commerce, Events, Sports, Productivity, Supply Chain, Tech, Developer Tools, Marketplace, HR Tech, Legal Tech, Creator Economy, Healthcare, PoS, Point of Sale, Cryptocurrency, Blockchain, Emerging Markets, Quality Assurance, RetailTech, Travel, Privacy, AudioTech, PropTech, E-Sports, Gaming, PaaS, Transportation, Hardware, Manufacturing, Computer, CMS, Virtual Reality, AR/VR, Advertising, AdTech, Robotics, Logistics, Health & Wellness, Food and Beverage, Telecommunications, TMT, Fashion, Hospitality, Infrastructure, SpaceTech"
Accel India,Venture Fund,"SeedSeries A,Series BSeries C,Series D",https://www.accel.com/,"PropTech, Artificial Intelligence, Machine Learning, AI, ML, Software, FinTech"
"AccelFoods, LLC",Venture Fund,"Pre-SeedSeed,Series A",www.afventures.vc,"Software, Mobile, SaaS, Consumer, FinTech"
Accelmed,Venture Fund,"Pre-SeedSeed,Series ASeries B,Series CSeries D",www.accelmed.com,"Cybersecurity, Healthcare, Information Technology, Medical Device"
Investor Name,Fund Type,Fund Stage,Website (if available),"Fund, Focus, Sectors"
Access Venture Partners,Venture Fund,SeedSeries A,www.accessvp.com,"E-Commerce, Cryptocurrency, Blockchain, PropTech, SaaS, Marketplace, B2B, B2C"
Access Ventures,Venture Fund,"Pre-SeedSeed,Series A",www.accessventures.org,"Cryptocurrency, Blockchain, Mobile, FinTech, InsurTech, Software, Developer Tools, Information Technology, Big Data, Analytics, ClimateTech, CleanTech"
Accomplice,Venture Fund,"Pre-SeedSeed,Series A",www.accomplice.co,"Travel, Computer, Cybersecurity, SaaS, Big Data, Analytics, Software, Consumer, Market Research, HR Tech, Events, Entertainment, Media, Artificial Intelligence, Machine Learning, AI, ML, Enterprise, Advertising, AdTech, E-Commerce, Marketing, MarTech, RetailTech, Sports, Cryptocurrency, Blockchain, FinTech, AudioTech, Customer Service, Information Technology, EdTech, Developer Tools, PropTech, Meeting Software, Healthcare, InsurTech, B2B, Supply Chain, Tech, Logistics, CloudTech, Food, Beverage, Medical, Device"
Acequia Capital (AceCap),Venture Fund,"SeedSeries A,Series B",http://acecap.com/,"CloudTech, Software, Big Data, Analytics, Marketing, MarTech, Sales, Hardware, Artificial Intelligence, Machine Learning, AI, ML, Advanced Materials, SaaS, Cybersecurity, Enterprise, BioTech, Healthcare, Health & Wellness, Information Technology, Developer Tools, E-Commerce, RetailTech, Consumer, Manufacturing, FinTech, PropTech, CRM, Future of Work, Logistics, Transportation, Energy, ClimateTech, CleanTech"
Acero Capital,Venture Fund,"Pre-SeedSeed,Series ASeries B,Series CSeries D",www.acerovc.com,"Software, Mobile, SaaS, Consumer, FinTech"
ACME Capital,Venture Fund,"Pre-SeedSeed,Series A",www.acme.vc,"E-Sports, Gaming, Software, Artificial Intelligence, Machine Learning, AI, ML, Information Technology, SaaS, Consumer, RestaurantTech, Travel"
Investor Name,Fund Type,Fund Stage,Website (if available),"Fund, Focus, Sectors"
Acre Venture Partners,Venture Fund,"Pre-SeedSeed,Series ASeries B,Series CSeries D",www.acre.vc,"B2B, E-Commerce, Enterprise, Food and Beverage, ClimateTech, CleanTech, SaaS, Software, Supply Chain, Tech, Healthcare, AgTech, FarmTech, Bio, Medical, Device"
Acrew Capital,Venture Fund,SeedSeries A,www.acrewcapital.com,"Artificial Intelligence, Machine Learning, AI, ML, FinTech, Big Data, Analytics, Cybersecurity, E-Commerce, SaaS, Future of Work"
Acronym Venture Capital,Venture Fund,SeedSeries A,https://acronymvc.com/,"Enterprise, SaaS, FinTech, PropTech, E-Commerce, Consumer, D2C"
Act One Ventures,Venture Fund,Seed,"http://www.actoneventures.c
om","Computer, Hardware, RetailTech, Software, Information Technology, SaaS, Advertising, AdTech, Big Data, Analytics, Marketing, MarTech, E-Commerce, FinTech, Construction, Tech, Developer Tools, Enterprise, Artificial Intelligence, Machine Learning, AI, ML"
Act Venture Capital,Venture Fund,"SeedSeries A,Series BSeries C,Series D","http://www.actventure.capita
l","Healthcare, Health & Wellness"
Activant Capital,Venture Fund,Series BSeries C,www.activantcapital.com,"Artificial Intelligence, Machine Learning, AI, ML, E-Commerce, FinTech, Healthcare, Infrastructure, IoT, Internet of Things, SaaS, Supply Chain, Tech, Telecommunications, TMT"
Activate Capital Partners,Venture Fund,"Series BSeries C,Series D",www.activatecp.com,"Energy, Oil & Gas, ClimateTech, CleanTech, PropTech, Enterprise, GovTech, Big Data, Analytics, IoT, Internet of Things, Software, Logistics, Productivity, Supply Chain, Tech, Artificial Intelligence, Machine Learning, AI, ML, FinTech, Consumer, Professional Services, Information Technology, InsurTech"
Activate Venture Partners,Venture Fund,"SeedSeries A,Series BSeries C,Series D",https://www.activatevp.com/,"Artificial Intelligence, Machine Learning, AI, ML, Healthcare, Health & Wellness, Big Data, Analytics, Information, Technology"
Investor Name,Fund Type,Fund Stage,Website (if available),"Fund, Focus, Sectors"
Active Capital,Venture Fund,Pre-SeedSeed,www.activecapital.com,"CloudTech, Artificial Intelligence, Machine Learning, AI, ML, Cryptocurrency, Blockchain, SaaS, Telecommunications, TMT"
Active Impact Investments,Venture Fund,"SeedSeries A,Series B","https://www.activeimpactinv
estments.com/","ClimateTech, CleanTech, Software"
Adage Capital Management,Family Office,"SeedSeries A,Series BSeries C,Series D","http://www.adagecapital.co
m","Artificial Intelligence, Machine Learning, AI, ML, Software, Healthcare, Health & Wellness, BioTech"
Adams Capital Management,Venture Fund,"Pre-SeedSeed,Series ASeries B,Series CSeries D",www.acm.com,"Software, Mobile, SaaS, Consumer, FinTech"
Adams Street Partners,Venture Fund,"SeedSeries A,Series BSeries C,Series D","https://www.adamsstreetpart
ners.com/","Healthcare, Marketplace, HR Tech, Big Data, Analytics, Information Technology, PropTech, Software, Cybersecurity, Mobile, PaaS, BioTech, Enterprise, SaaS, Artificial Intelligence, Machine Learning, AI, ML, Consumer, CRM, Entertainment, Media, Marketing, MarTech"
Adapt,Venture Fund,"Pre-SeedSeed,Series A",www.adaptvc.co,"Health & Wellness, Healthcare, Consumer, Delivery, Food and Beverage, HR Tech, Software, Computer, CRM, Mobile, Productivity, Entertainment, Media"
Adara Ventures,Venture Fund,"SeedSeries A,Series B",http://www.adara.vc,"Artificial Intelligence, Machine Learning, AI, ML, B2B, B2C, CloudTech, E-Commerce, FinTech, SaaS"
Addition,Venture Fund,"Pre-SeedSeed,Series A",www.addition.com,"Big Data, Analytics, Software, CloudTech, Information, Technology, Artificial Intelligence, Machine Learning, AI, ML, Computer, Advertising, AdTech, SaaS, Developer Tools, Robotics, Consumer, Healthcare, InsurTech, Energy, ClimateTech, CleanTech"
Adit Ventures,Venture Fund,"SeedSeries A,Series BSeries C","https://www.aditventures.co
m","Telecommunications, TMT"
Adit Ventures,Venture Fund,"Pre-SeedSeed,Series ASeries B,Series CSeries D",www.aditventures.com,"CloudTech, Information Technology, Software"
Investor Name,Fund Type,Fund Stage,Website (if available),"Fund, Focus, Sectors"
Adjuvant Capital,Venture Fund,"Pre-SeedSeed,Series ASeries B,Series CSeries D",www.adjuvantcapital.com,"Software, Mobile, SaaS, Consumer, FinTech"
Adobe,Corporate VC,"Series BSeries C,Series D",http://www.adobe.com,"Advertising, AdTech, Big Data, Analytics, Marketing, MarTech, SaaS, CloudTech, Collaboration, Productivity, Tools"
Advance Venture Partners,Venture Fund,"Pre-SeedSeed,Series A",www.avp.vc,"Artificial Intelligence, Machine Learning, AI, ML, Big Data, Analytics, Developer Tools, Advertising, AdTech, Marketing, MarTech, InsurTech, PropTech"
Advanced Technology Ventures,Venture Fund,"Pre-SeedSeed,Series ASeries B,Series CSeries D",www.atvcapital.com,"Software, Mobile, SaaS, Consumer, FinTech"
Advantage Capital,Venture Fund,"Pre-SeedSeed,Series ASeries B,Series DSeries C",www.advantagecap.com,"AgTech, FarmTech, ClimateTech, CleanTech, E-Commerce, Healthcare, Impact Investing, IoT, Internet of Things, Life Science, Manufacturing, Oil & Gas, SaaS, Telecommunications, TMT, B2B"
AE Industrial Partners,Venture Fund,Series CSeries D,http://www.aeroequity.com/,"SpaceTech, Transportation, Energy, ClimateTech, CleanTech"
Affinity Capital Management,Venture Fund,"Pre-SeedSeed,Series ASeries B,Series CSeries D","www.affinitycapitalmanagem
ent.com","Software, Mobile, SaaS, Consumer, FinTech"
Affirm,Corporate VC,Series ASeries B,https://affirm.com,"Fin, Tech"
AFI Capital Partners,Venture Fund,"SeedSeries A,Series B","http://www.aficapitalpartners
.com/","Manufacturing, SaaS, Telecommunications, TMT"
Afore Capital,Venture Fund,Seed,www.afore.vc,"Artificial Intelligence, Machine Learning, AI, ML, CloudTech, Big Data, Analytics, Developer Tools, Information Technology, E-Commerce, Computer, Cybersecurity, Software, Consumer, InsurTech"
AFSquare,Venture Fund,"Pre-SeedSeed,Series A",www.afsquare.com,"Software, Mobile, SaaS, Consumer, FinTech"
Ag Startup Engine,Venture Fund,"Pre-SeedSeed,Series A",www.agstartupengine.com,"BioTech, Healthcare, Pharmaceuticals"
Investor Name,Fund Type,Fund Stage,Website (if available),"Fund, Focus, Sectors"
AgFunder,Venture Fund,"SeedSeries A,Series CSeries D,Series B",www.agfunder.com,"AgTech, FarmTech, Big Data, Analytics, ClimateTech, CleanTech, RestaurantTech, IoT, Internet of Things, Life Science, Robotics, SaaS"
Agilent Technologies,Corporate VC,Series BSeries C,http://www.agilent.com,"BioTech, Life Science, Healthcare"
Agility Capital,Venture Fund,"SeedSeries A,Series B",http://www.agilitycap.com,"Delivery, Food and Beverage, RestaurantTech"
Agya Ventures,Venture Fund,"Pre-SeedSeed,Series A",https://agyaventures.com/,"Virtual Reality, AR/VR, Construction, Tech, IoT, Internet of Things, Micro-Mobility, PropTech"
