Investor Name,Fund Type,Fund Stage,Website,Fund Focus (Sectors)
Correlation Ventures,Venture Fund,"Pre-SeedSeed,Series ASeries B,Series CSeries D",www.correlationvc.com,"Manufacturing, Advertising, AdTech, Big Data, Analytics, ClimateTech, CleanTech, Cybersecurity, E-Commerce, EdTech, FinTech, Healthcare, Infrastructure, IoT, Internet of Things, Life Science, Marketing, MarTech, Mobile, Robotics, SaaS, Wearables, Quantified Self"
Corsa Ventures,Venture Fund,"SeedSeries A,Series B","http://www.corsaventures.co
m","Mobile, Delivery, Logistics, RestaurantTech"
Corsair Capital,Venture Fund,"Series BSeries C,Series D",www.corsair-capital.com,"Software, Mobile, SaaS, Consumer, FinTech"
Cortado Ventures,Venture Fund,"Pre-SeedSeed,Series A",www.cortado.ventures,"Software, Mobile, SaaS, Consumer, FinTech"
COSIMO Ventures,Venture Fund,"SeedSeries A,Series B",http://cosimoventures.com,"Artificial Intelligence, Machine Learning, AI, ML, FinTech, Cryptocurrency, Blockchain"
Costanoa Ventures,Venture Fund,"Pre-SeedSeed,Series A",www.costanoavc.com,"CloudTech, Cybersecurity, SaaS, Artificial Intelligence, Machine Learning, AI, ML, Big Data, Analytics, Information Technology, Developer Tools, Software, Healthcare, EdTech, CRM, Computer, Hardware, Transportation, Simulation, Cryptocurrency, Blockchain, E-Commerce, FinTech, Marketing, MarTech, RetailTech"
Cota Capital,Venture Fund,"Pre-SeedSeed,Series ASeries B,Series CSeries D",www.cotacapital.com,"Artificial Intelligence, Machine Learning, AI, ML, Big Data, Analytics, FinTech, Healthcare, Infrastructure, IoT, Internet of Things, SaaS, Telecommunications, TMT"
Investor Name,Fund Type,Fund Stage,Website (if available),"Fund, Focus, Sectors"
Counterpart Ventures,Venture Fund,"SeedSeries A,Series BSeries C,Series D",http://counterpart.vc,"Big Data, Analytics, Marketing, MarTech, Sales, Enterprise, Information Technology, Risk Management, SaaS, Software"
Counterview Capital,Venture Fund,"Pre-SeedSeed,Series A",www.counterview.vc,"EdTech, Enterprise, SaaS, Entertainment, Media"
Courtside Ventures,Venture Fund,"SeedSeries A,Series B",http://www.courtsidevc.com/,"Entertainment, Media, Sports, Robotics, Virtual Reality, AR/VR, Consumer, Cryptocurrency, Blockchain, E-Commerce, Creator Economy, FinTech, Health & Wellness, Healthcare, Software, B2B, B2C"
CourtsideVC,Venture Fund,"Pre-SeedSeed,Series A",www.courtsidevc.com,"Advertising, AdTech, E-Sports, Gaming, Healthcare, SaaS, Telecommunications, TMT"
Cove Fund,Venture Fund,Seed,http://covefund.com,"Bio, Tech"
CoVenture Holding Company,Venture Fund,"SeedSeries A,Series B",http://www.coventure.vc,"Entertainment, Media, FinTech, Consumer, E-Commerce"
Covington Group,Venture Fund,"Pre-SeedSeed,Series ASeries B,Series CSeries D","www.covingtongroupinc.co
m","Software, Mobile, SaaS, Consumer, FinTech"
Cowboy Ventures,Venture Fund,"Pre-SeedSeed,Series A",www.cowboy.vc,"Collaboration, Developer Tools, Software, Cybersecurity, Big Data, Analytics, HR Tech, Productivity, SaaS, Artificial Intelligence, Machine Learning, AI, ML, Information Technology, E-Sports, Gaming, Beauty, Consumer, E-Commerce, Entertainment, Media, Events, RetailTech, FinTech, PropTech, Community, Professional Services, Healthcare, EdTech, Elder Care, Logistics, Robotics, Supply Chain, Tech, B2B, Enterprise, Sales, AudioTech"
Coyote Ventures,Venture Fund,Seed,"https://www.coyote.ventures
/","FemTech, Healthcare"
CP Ventures,Venture Fund,"SeedSeries A,Series B",https://cp.ventures/,"Information Technology, Mobile, Software"
Craft Ventures,Venture Fund,"Pre-SeedSeed,Series A",www.craftventures.com,"Cryptocurrency, Blockchain, E-Commerce, SaaS, Telecommunications, TMT"
Investor Name,Fund Type,Fund Stage,Website (if available),"Fund, Focus, Sectors"
Cranberry Capital,Venture Fund,"SeedSeries A,Series B",http://crancap.com/,"ClimateTech, CleanTech"
Crane Venture Partners,Venture Fund,"SeedSeries A,Series B",https://www.crane.vc/,"Big Data, Analytics, Artificial Intelligence, Machine Learning, AI, ML, Software, Developer Tools, CloudTech, Cybersecurity, Information, Technology"
CRE Venture Capital,Venture Fund,"Pre-SeedSeed,Series A",www.cre.vc,"Software, Mobile, SaaS, Consumer, FinTech"
Creandum,Venture Fund,"SeedSeries A,Series BSeries C,Series D",http://www.creandum.com,"Big Data, Analytics, Artificial Intelligence, Machine Learning, AI, ML, Quality Assurance, SaaS, Software, Collaboration, Developer Tools, Professional Services"
Creative Ventures,Venture Fund,"Pre-SeedSeed,Series A",www.creativeventures.vc,"Software, Mobile, SaaS, Consumer, FinTech"
CreativeCo Capital,Venture Fund,"SeedSeries A,Pre-Seed",www.creative.co,"Artificial Intelligence, Machine Learning, AI, ML, FinTech, CloudTech, Healthcare, HR Tech, Marketing, MarTech, Micro-Mobility, PropTech, SaaS, Supply Chain, Tech"
Credo Ventures,Venture Fund,"SeedSeries A,Series B","http://www.credoventures.co
m","Developer Tools, Information Technology, PropTech, Marketing, MarTech, SaaS, Software"
Crescendo Venture Partners,Venture Fund,"SeedSeries A,Series B",https://www.cr-vp.com/,"CloudTech, Information Technology, SaaS, Software"
Crescendo Ventures,Venture Fund,"Pre-SeedSeed,Series ASeries B,Series CSeries D",www.crescendoventures.com,"Software, Mobile, SaaS, Consumer, FinTech"
Crescent Cove Advisors,Venture Fund,"Series CSeries B,Series D",https://crescentcove.com/,"ClimateTech, CleanTech, Software, Energy, Industrials, Manufacturing, Developer Tools, Transportation, Consumer, Food and Beverage, Prop, Tech"
Investor Name,Fund Type,Fund Stage,Website (if available),"Fund, Focus, Sectors"
Crescent Fund,Venture Fund,"SeedSeries A,Series B","https://www.crescentfund.vc
/","FinTech, SaaS, Cryptocurrency, Blockchain, Advertising, AdTech, Big Data, Analytics, PropTech, Manufacturing, Artificial Intelligence, Machine Learning, AI, ML, Virtual Reality, AR/VR, Developer Tools, AgTech, FarmTech, AudioTech, B2C, Beauty, B2B, Bio, Tech, Black, African, American, Founded, Cannabis, ClimateTech, CleanTech, Productivity, CloudTech, Cloud, Security, Construction, Infrastructure, Consumer, Creator Economy, CRM, Hardware, Cybersecurity, Wearables, Quantified Self, Customer Service, D2C, DeepTech, Healthcare, Entertainment, Media, E-Commerce, EdTech, HR Tech, Energy, Enterprise, E-Sports, Gaming, Events, FemTech, Food and Beverage, RestaurantTech, Future of Work, GovTech, Impact Investing, Information Technology, InsurTech, IoT, Internet of Things, Telecommunications, TMT, Mobile, Legal Tech, Life Science, Marketing, MarTech, Logistics, Marketplace, Meeting Software, Micro-Mobility, Network Security, Neuroscience, Oil & Gas, Travel, PaaS, PetTech, Pharmaceuticals, Recruiting, RetailTech, Robotics, Sales, Ridesharing, Sharing Economy, Social Media, Sports, Supply Chain, Sustainability, Women-Founded, Transportation, SpaceTech, Software"
Crimson Seed Capital,Venture Fund,"Pre-SeedSeed,Series A","www.crimsonseedcapital.co
m","Software, Mobile, SaaS, Consumer, FinTech"
Cross Creek,Venture Fund,"Series BSeries C,Series D",www.crosscreek.vc,"Information Technology, Software"
Investor Name,Fund Type,Fund Stage,Website (if available),"Fund, Focus, Sectors"
Crosscut Ventures,Venture Fund,"Pre-SeedSeed,Series ASeries B,Series CSeries D",www.crosscut.vc,"Developer Tools, PropTech, Professional Services, Software, ClimateTech, CleanTech, Healthcare, Health & Wellness, Consumer, Delivery, Food and Beverage, Community, E-Sports, Gaming, Creator Economy, Entertainment, Media, Advertising, AdTech, Big Data, Analytics, Artificial Intelligence, Machine Learning, AI, ML, Enterprise, E-Commerce, B2B, HR Tech, Information Technology, Energy, IoT, Internet of Things"
Crosslink Capital,Venture Fund,"Pre-SeedSeed,Series A",www.crosslinkcapital.com,"Advertising, AdTech, Big Data, Analytics, Cybersecurity, E-Commerce, FinTech, IoT, Internet of Things, Marketing, MarTech, Mobile, SaaS"
CRV,Venture Fund,"Pre-SeedSeed,Series ASeries B,Series CSeries D",www.crv.com,"Consumer, PoS, Point of Sale, Logistics, Software, Cybersecurity, Enterprise, Network Security, Big Data, Analytics, Developer Tools, HR Tech, SaaS, Information Technology, Productivity, PropTech, Delivery, Sales, Food and Beverage, Hospitality, FinTech, RestaurantTech, B2B, E-Commerce, Entertainment, Media, RetailTech, Meeting Software, Energy, Transportation, Parenting, Healthcare, Artificial Intelligence, Machine Learning, AI, ML, CRM, CMS, Travel, Community, Marketplace, Marketing, MarTech, Mobile, Collaboration, Hardware, IoT, Internet of Things, Computer, EdTech, Risk Management, Telecommunications, TMT, Professional Services, E-Sports, Gaming, Virtual Reality, AR/VR, PaaS, BioTech, Pharmaceuticals, Privacy, CloudTech, Infrastructure"
Cue Ball,Venture Fund,"SeedSeries A,Series BSeries C,Series D",http://www.cueball.com,"Advertising, AdTech, Virtual Reality, AR/VR, Big Data, Analytics, Healthcare, E-Commerce, IoT, Internet of Things, Life Science, Mobile, SaaS, Telecommunications, TMT"
Investor Name,Fund Type,Fund Stage,Website (if available),"Fund, Focus, Sectors"
Cult Capital,Venture Fund,SeedSeries A,https://www.cultcapital.com/,"Food and Beverage, Consumer"
Cultivation Capital,Venture Fund,"Pre-SeedSeed,Series A",www.cultivationcapital.com,"Life Science, Healthcare, Software, Information Technology, AgTech, FarmTech, FinTech"
Curate Capital,Venture Fund,"SeedSeries A,Series B",https://curate.capital/,"Telecommunications, TMT"
Cybernaut Venture Capital,Venture Fund,"Series ASeed,Series BSeries C,Series D","http://www.cybernaut.com.c
n/en_intro.html","E-Commerce, FinTech, Marketplace, EdTech"
Cyberstarts,Venture Fund,Seed,http://www.cyberstarts.com/,"Cybersecurity, Enterprise, Information Technology, Software, Network Security, CloudTech"
Dallas Venture Capital,Venture Fund,"Pre-SeedSeed,Series A",www.dallasvc.com,"Artificial Intelligence, Machine Learning, AI, ML, Collaboration, Enterprise, PaaS, Software, FinTech, Consumer, Developer Tools, Mobile, SaaS"
Daphni,Venture Fund,"SeedSeries A,Series B",http://www.daphni.com,"Healthcare, Food and Beverage, Professional Services, Software"
Dapper Labs,Corporate VC,"SeedSeries A,Series BSeries C",https://www.dapperlabs.com,"Entertainment, Media, Virtual Reality, AR/VR, Big Data, Analytics, Cryptocurrency, Blockchain, Software, Creator Economy, Service Industry, PropTech, Consumer, E-Commerce, Cybersecurity, Network Security, Community, E-Sports, Gaming, Information Technology"
Darling Ventures,Venture Fund,Seed,www.DarlingVentures.com,"Big Data, Analytics, Construction, Tech, FinTech, Infrastructure, PropTech, SaaS, Software"
Dash Fund,Venture Fund,"SeedSeries A,Series B",https://dashfund.co/,"FinTech, SaaS"
Data Point Capital,Venture Fund,"Pre-SeedSeed,Series A",www.datapointcapital.com,"Delivery, Cybersecurity, Risk Management, SaaS, Software, HR Tech, Marketplace, Mobile, Healthcare, Health & Wellness, Consumer, E-Commerce, Information Technology"
Data Tech Fund,Venture Fund,"SeedSeries A,Series B",https://www.datatech.fund/,"Sports, E-Sports, Gaming, Information Technology, Software"
Investor Name,Fund Type,Fund Stage,Website (if available),"Fund, Focus, Sectors"
Databricks Ventures,Corporate VC,"Series ASeries B,Series CSeries D","https://databricks.com/datab
ricks-ventures","Software, Big Data, Analytics, Artificial Intelligence, Machine Learning, AI, ML"
DataTribe,Venture Fund,Seed,www.datatribe.com,"Big Data, Analytics, Cybersecurity, IoT, Internet of Things, Telecommunications, TMT"
Dawn Capital,Venture Fund,"SeedSeries A,Series B",http://www.dawncapital.com,"CloudTech, Developer Tools, Software, Transportation, B2B, SaaS, Collaboration, Professional Services, Artificial Intelligence, Machine Learning, AI, ML, Information Technology, CMS"
Day One Capital,Venture Fund,"SeedSeries A,Series B","http://www.dayonecapital.co
m","PropTech, Marketing, MarTech, Information Technology, SaaS, Software"
Day One Ventures,Venture Fund,"SeedSeries A,Series B",http://dayoneventures.com/,"FinTech, Professional Services, EdTech, Productivity, Artificial Intelligence, Machine Learning, AI, ML, Hardware, Parenting, Marketplace, Construction, Tech, Marketing, MarTech, RestaurantTech, Sales, Software, HR Tech, Information Technology, Virtual Reality, AR/VR, Computer, Entertainment, Media, Creator Economy, PropTech, SaaS, Consumer, E-Commerce, RetailTech, Cybersecurity"
Daymond John,Angel Investor,Pre-SeedSeed,www.daymondjohn.com,"PaaS, Consumer, D2C, RetailTech, Food and Beverage, FoodTech"
Investor Name,Fund Type,Fund Stage,Website (if available),"Fund, Focus, Sectors"
DCM Ventures,Venture Fund,"Pre-SeedSeed,Series A",www.dcm.com,"EdTech, E-Sports, Gaming, Consumer, E-Commerce, Healthcare, Marketplace, Community, Advertising, AdTech, Health & Wellness, Entertainment, Media, Sports, Creator Economy, Fashion, Wearables, Quantified Self, Information Technology, IoT, Internet of Things, Telecommunications, TMT, Software, ClimateTech, CleanTech, Parenting, Artificial Intelligence, Machine Learning, AI, ML, Transportation, SpaceTech, Big Data, Analytics, Robotics, Mobile, PropTech, Hardware, SaaS, FinTech, Customer Service, Enterprise, AgTech, FarmTech, PetTech, Marketing, MarTech, Life Science, Travel, HR Tech"
DCVC,Venture Fund,"Pre-SeedSeed,Series ASeries B,Series CSeries D",www.dcvc.com,"AgTech, FarmTech, Artificial Intelligence, Machine Learning, AI, ML, Big Data, Analytics, Developer Tools, Information Technology, SaaS, BioTech, Healthcare, ClimateTech, CleanTech, Entertainment, Media, Advanced Materials, Energy, Oil & Gas, CloudTech, PaaS, Productivity, Software, Cybersecurity, E-Commerce, Enterprise, FinTech, Network Security, Robotics, PropTech, SpaceTech, IoT, Internet of Things, Hardware, Manufacturing, Life Science, Pharmaceuticals, CRM, Risk Management, Supply Chain, Tech, B2B, HR Tech, Infrastructure, Computer, Customer Service, Transportation, Professional Services, Community, Consumer, GovTech, Advertising, AdTech, Marketing, MarTech, Food and Beverage, InsurTech"
Debut Capital,Venture Fund,"SeedSeries A,Series B",http://debutcapital.com/,"Beauty, Fashion, Manufacturing"
Investor Name,Fund Type,Fund Stage,Website (if available),"Fund, Focus, Sectors"
Decathlon Capital Partners,Venture Fund,"Pre-SeedSeed,Series A",www.decathloncapital.com,"Software, Mobile, SaaS, Consumer, FinTech"
Decheng Capital,Venture Fund,Seed,www.decheng.com,"BioTech, Healthcare, Life Science, Big Data, Analytics, Pharmaceuticals, Advanced Materials"
Decibel Partners,Venture Fund,"SeedSeries A,Series B",www.decibel.vc,"Enterprise, Software, Developer Tools, Cybersecurity, Artificial Intelligence, Machine Learning, AI, ML, Infrastructure"
Deciens Capital,Venture Fund,"Pre-SeedSeed,Series A",www.deciens.com,"EdTech, FinTech, InsurTech, IoT, Internet of Things, SaaS, Telecommunications, TMT"
Declaration Partners,Venture Fund,"Series ASeries B,Series C","http://declarationpartners.co
m","Big Data, Analytics, Artificial Intelligence, Machine Learning, AI, ML, BioTech, Pharmaceuticals, SaaS, Healthcare, Food and Beverage, Hospitality, RestaurantTech"
DeepWork Capital,Venture Fund,"Pre-SeedSeed,Series A",www.deepworkcapital.com,"FinTech, Software, Consumer, Professional Services, Information Technology, InsurTech, Apps"
Deerfield,Venture Fund,"SeedSeries A,Series B",http://www.deerfield.com,"BioTech, Healthcare, Health & Wellness, AgTech, FarmTech, Food and Beverage, Artificial Intelligence, Machine Learning, AI, ML, Pharmaceuticals, Wearables, Quantified Self, Information Technology, Big Data, Analytics"
Deerfield Management,Venture Fund,"Pre-SeedSeed,Series A",www.deerfield.com,"Healthcare, E-Sports, Gaming, Life Science"
Defy.vc,Venture Fund,"Pre-SeedSeed,Series A",www.defy.vc,"Logistics, Software, Supply Chain, Tech, E-Commerce, Fashion, Artificial Intelligence, Machine Learning, AI, ML, Sales, Marketing, MarTech, Mobile, Healthcare, HR Tech, SaaS, EdTech, Computer, Big Data, Analytics, Risk Management, Marketplace, Cybersecurity"
Delphi Digital,Venture Fund,"Pre-SeedSeed,Series A",https://www.delphidigital.io,"Cryptocurrency, Blockchain, Information Technology, Software"
Investor Name,Fund Type,Fund Stage,Website (if available),"Fund, Focus, Sectors"
Delphi Ventures,Venture Fund,"Pre-SeedSeed,Series ASeries B,Series CSeries D",www.delphiventures.com,"Software, Mobile, SaaS, Consumer, FinTech"
Delta-v Capital,Venture Fund,Series CSeries D,"http://www.deltavcapital.co
m","Artificial Intelligence, Machine Learning, AI, ML, Big Data, Analytics, CloudTech, Cybersecurity, E-Commerce, FinTech, HR Tech, Micro-Mobility, SaaS, Telecommunications, TMT"
Dentsu Ventures,Corporate VC,"SeedSeries A,Series B",http://dentsu-v.com/,"Hardware, IoT, Internet of Things, Manufacturing, Marketplace, SaaS"
Designer Fund,Venture Fund,"SeedSeries A,Series B",http://designerfund.com,"HR Tech, Information Technology, Software"
Detroit Venture Partners,Venture Fund,"SeedSeries A,Series B",http://Detroit.vc,"EdTech, FinTech, Delivery, E-Commerce, Consumer, RetailTech, PropTech, AgTech, FarmTech, Big Data, Analytics, Software, Logistics, Supply Chain, Tech, Hardware, Virtual Reality, AR/VR, Advanced Materials, B2B, B2C, Health & Wellness, Healthcare"
"Deutsche Telekom Strategic
Investments",Corporate VC,"SeedSeries A,Series BSeries C,Series D",https://www.dtcp.capital,"FinTech, IoT, Internet of Things, Logistics, SaaS, Supply Chain, Tech"
DFJ Growth,Venture Fund,"SeedSeries A,Series BSeries C,Series D",http://dfjgrowth.com,"Artificial Intelligence, Machine Learning, AI, ML, Big Data, Analytics, ClimateTech, CleanTech, Cybersecurity, E-Commerce, IoT, Internet of Things, Mobile, SaaS"
DGNL Ventures,Venture Fund,"Pre-SeedSeed,Series A",www.dgnl.vc,"Software, Mobile, SaaS, Consumer, FinTech"
DHVC,Venture Fund,"Pre-SeedSeed,Series ASeries B,Series CSeries D",www.dh.vc,"Artificial Intelligence, Machine Learning, AI, ML, Virtual Reality, AR/VR, Big Data, Analytics, Cryptocurrency, Blockchain, FinTech, Healthcare, IoT, Internet of Things, Life Science, Mobile, Robotics, Saa, S"
Investor Name,Fund Type,Fund Stage,Website (if available),"Fund, Focus, Sectors"
Diagram Ventures,Venture Fund,"SeedSeries A,Series BSeries C,Series D",https://diagram.ca/,"FinTech, PropTech"
Diamond State Ventures,Venture Fund,"Pre-SeedSeed,Series A","www.new.diamondstatevent
ures.com","Software, Mobile, SaaS, Consumer, FinTech"
Diaspora Ventures,Venture Fund,Seed,https://www.diaspora.vc/,"SaaS, Telecommunications, TMT"
Differential Ventures,Venture Fund,Pre-SeedSeed,www.differential.vc,"Artificial Intelligence, Machine Learning, AI, ML, Big Data, Analytics, Cybersecurity, FinTech, IoT, Internet of Things, SaaS, Enterprise"
Dig Ventures,Family Office,"SeedSeries A,Series B",http://dig.ventures,"SaaS, Software"
Digital Horizon,Venture Fund,"SeedSeries A,Series BSeries C,Series D",http://digitalhorizon.vc/,"FinTech, Information Technology, PropTech"
Digital+ Partners,Venture Fund,Series CSeries D,http://www.dplus.partners/,"FinTech, Mobile, Software"
Digitalis Ventures,Venture Fund,"Pre-SeedSeed,Series ASeries B,Series CSeries D",www.digitalisventures.com,"AgTech, FarmTech, Parenting, BioTech, Food and Beverage, Information Technology, Software, FinTech, PetTech, HR Tech, GovTech, Community, Healthcare, Entertainment, Media, Health & Wellness"
DigiTx Partners,Venture Fund,"Pre-SeedSeed,Series A",www.digitxpartners.com,"Healthcare, Information Technology, SaaS, Software"
Distributed Global,Venture Fund,"Pre-SeedSeed,Series A",www.distributedglobal.com,"Cryptocurrency, Blockchain, FinTech"
Divergent Ventures,Venture Fund,"SeedSeries A,Series BSeries C,Series D",http://www.divergentvc.com,"Professional Services, CloudTech, PropTech, Information Technology, SaaS, Software"
DN Capital,Venture Fund,"Pre-SeedSeed,Series A",www.dncapital.com,"Sales, CMS, Enterprise, SaaS, CRM, PropTech, Software, Big Data, Analytics, Healthcare, Health & Wellness, Information Technology, Infrastructure, Artificial Intelligence, Machine Learning, AI, ML"
Investor Name,Fund Type,Fund Stage,Website (if available),"Fund, Focus, Sectors"
DNA Capital,Venture Fund,"SeedSeries A,Series BSeries C,Series D",http://www.dnacapital.com/,"Healthcare, BioTech, Life Science"
DNS Capital,Family Office,"Pre-SeedSeed,Series A",www.dnscap.com,"Artificial Intelligence, Machine Learning, AI, ML, Software, E-Commerce, Logistics, Robotics, Supply Chain, Tech"
DNX Ventures,Venture Fund,"Pre-SeedSeed,Series A",www.dnx.vc,"Artificial Intelligence, Machine Learning, AI, ML, Cybersecurity, Information Technology, SaaS, Healthcare, Health & Wellness, Professional Services, Consumer, PropTech, IoT, Internet of Things, CloudTech, Big Data, Analytics, Network Security, Marketplace, Mobile, Software, Developer Tools"
DocuSign,Corporate VC,Series ASeries B,http://www.docusign.com,"Enterprise, Legal Tech, Privacy, SaaS, Artificial Intelligence, Machine Learning, AI, ML, Big Data, Analytics, Productivity, Software"
Domain Associates,Venture Fund,"Pre-SeedSeed,Series ASeries B,Series CSeries D",www.domainvc.com,"BioTech, Pharmaceuticals"
Dorm Room Fund,Venture Fund,Seed,http://dormroomfund.com,"Telecommunications, TMT"
Double Peak Group,Family Office,"SeedSeries A,Series B",https://doublepeak.io,"Cryptocurrency, Blockchain, E-Sports, Gaming, Software"
Downing Ventures,Venture Fund,"SeedSeries A,Series BSeries C,Series D","https://downing.co.uk/ventu
res/","Energy, Advanced Materials"
Draft Ventures,Venture Fund,"Pre-SeedSeed,Series A",www.draftvc.com,"Advertising, AdTech, Marketing, MarTech, Creator Economy, E-Commerce, Hospitality, Marketplace, RestaurantTech, RetailTech, Food and Beverage"
Dragoneer Investment Group,Venture Fund,"Pre-SeedSeed,Series ASeries B,Series CSeries D",www.dragoneer.com,"Artificial Intelligence, Machine Learning, AI, ML, InsurTech, Robotics, Telecommunications, TMT"
Dragonfly Capital Partners,Venture Fund,"Pre-SeedSeed,Series A",www.dcp.capital,"Cryptocurrency, Blockchain, FinTech, SaaS, Telecommunications, TMT"
Investor Name,Fund Type,Fund Stage,Website (if available),"Fund, Focus, Sectors"
Draper B1,Venture Fund,"SeedSeries A,Series B",https://draperb1.vc/,"Big Data, Analytics, Artificial Intelligence, Machine Learning, AI, ML, Information Technology, Developer Tools, HR Tech, Health, Wellness"
Draper Goren Holm,Accelerator,"SeedSeries A,Series B","https://drapergorenholm.co
m/","Cryptocurrency, Blockchain, Cybersecurity, FinTech"
Draper Triangle,Venture Fund,"Pre-SeedSeed,Series A",www.drapertriangle.com,"Software, Mobile, SaaS, Consumer, FinTech"
Dreamers VC,Venture Fund,"Pre-SeedSeed,Series A",www.dreamers.vc,"BioTech, Healthcare, Life Science, EdTech, Information Technology"
Dreamit Ventures,Venture Fund,"Pre-SeedSeed,Series A",www.dreamit.com,"Healthcare, Big Data, Analytics, Artificial Intelligence, Machine Learning, AI, ML, Software, Information Technology, Events, PropTech, Network Security, Health & Wellness, FinTech, Developer Tools, Cryptocurrency, Blockchain, Cybersecurity, SaaS, Computer, Enterprise, Productivity"
Drive Capital,Venture Fund,"Pre-SeedSeed,Series A",www.drivecapital.com,"Enterprise, ClimateTech, CleanTech, Software, Artificial Intelligence, Machine Learning, AI, ML, Creator Economy, E-Sports, Gaming, EdTech, Mobile, AgTech, FarmTech, Big Data, Analytics, Food and Beverage, Robotics, SaaS, FinTech, Legal Tech"
Drummond Road Capital,Venture Fund,"Pre-SeedSeed,Series A",www.drummondroad.com,"Software, Mobile, SaaS, Consumer, FinTech"
DTCP,Venture Fund,Series CSeries D,https://www.dtcp.capital/,"Computer, Cybersecurity"
Dundee Venture Capital,Venture Fund,"SeedSeries A,Series B","http://www.dundeeventurec
apital.com","AgTech, FarmTech, Artificial Intelligence, Machine Learning, AI, ML, FinTech, Construction, Tech, Cryptocurrency, Blockchain, Cybersecurity, E-Commerce, Infrastructure, IoT, Internet of Things, Manufacturing, Mobile, SaaS, Supply Chain"
Durable Capital Partners,Venture Fund,"Series BSeries C,Series D",www.durablecap.com,"Healthcare, SaaS, Telecommunications, TMT"
Investor Name,Fund Type,Fund Stage,Website (if available),"Fund, Focus, Sectors"
Dynamk Capital,Venture Fund,"Pre-SeedSeed,Series A",www.dynamk.vc,"Software, Mobile, SaaS, Consumer, FinTech"
E-Merge,Venture Fund,"SeedSeries A,Series B",http://www.emerge.be,"Developer Tools, FinTech, Information Technology, Cybersecurity, Software"
E2JDJ,Venture Fund,"SeedSeries A,Series B",https://www.e2jdj.com,"AgTech, FarmTech, Manufacturing, Robotics, FoodTech"
Eagle Venture Fund,Venture Fund,Series C,"https://www.eagleventurefun
d.com/","BioTech, Healthcare, Life Science"
Early Light Ventures,Venture Fund,"Pre-SeedSeed,Series A",www.earlylight.vc,"Community, Hospitality"
Earlybird Venture Capital,Venture Fund,"SeedSeries A,Series BSeries C,Series D",http://earlybird.com/,"Computer, Cybersecurity, Software, CloudTech, Enterprise, Developer Tools, SaaS, Big Data, Analytics"
Earthshot Ventures,Venture Fund,Series A,https://www.earthshot.vc,"Manufacturing, AgTech, FarmTech, Artificial Intelligence, Machine Learning, AI, ML, Big Data, Analytics, ClimateTech, CleanTech, FinTech, RestaurantTech, Impact Investing, Infrastructure, IoT, Internet of Things, Micro-Mobility, Robotics, Supply Chain, Tech"
East Ventures,Venture Fund,"SeedSeries A,Series B",https://east.vc,"Food and Beverage, Healthcare, Professional Services, Consumer, PropTech, IoT, Internet of Things, Hospitality, SaaS, Travel, Artificial Intelligence, Machine Learning, AI, ML, Software, Information Technology, Developer Tools"
Eastlink Capital,Venture Fund,"SeedSeries A,Series BSeries C,Series D",http://www.eastlinkcap.com,"Artificial Intelligence, Machine Learning, AI, ML, FinTech, Big Data, Analytics, CloudTech, Cybersecurity, Healthcare, E-Commerce, Infrastructure, SaaS, Telecommunications, TMT"
Eastside Partners,Venture Fund,"SeedSeries A,Series B",http://eastsidepartners.com,"Consumer, IoT, Internet of Things, Software, ClimateTech, CleanTech, Sales, Mobile, Telecommunications, TMT"
